Posição Global;Posição Categoria;Subcategoria;ASIN;Nome;Preço à vista;Nota Geral;Qtd. Avaliações;Caractéristicas;País;Nota Comentário;Data Comentário;Comentário;Link
348;17;Games;MLB27417618;Fone Headset Gamer Havit H2230d P2 P3 3,5mm Microfone Removível Consoles Pc Preto;129,00;4,7;6548;{'Cor': 'Preto'};Brasil;4;14/03/2024;"O áudio é muito bom. Microfone mediano.
Nas duas primeiras semanas chegava a dar dor de cabeça de tão apertado, com o tempo foi laceando. Não recomendo se vc for o megamente.";https://www.mercadolivre.com.br/fone-headset-gamer-havit-h2230d-p2-p3-35mm-microfone-removivel-consoles-pc-preto/p/MLB27417618
349;18;Games;LBU3094415486;Controle Colorido Sem Fio Compativel Com Ps4 Pc Celular Preto;110,89;4,8;3511;{'Cor': 'Preto'};Brasil;4;13/07/2025;Olha é uma réplica muito boa mesmo bem feita bem acabada funciona muito bem sem nem um problema até agora joguei bastante sem nem um problema pode comprar sem medo vale cada centavo de momento bom.;https://www.mercadolivre.com.br/controle-colorido-sem-fio-compativel-com-ps4-pc-celular/up/MLBU3094415486
350;19;Games;MLB54963150;Console Playstation 5 Slim Edição Digital 825 Gb Branco;3366,80;4,9;2952;{'Cor': 'Branco'};Brasil;4;28/10/2025;Por enquanto tá bom, a caixa vei com furo, como se tivesse caído ou jogado, por enquanto não tá apresentando nenhum problema, mas é complicado. Todo cliente merece receber seu produto com máximo de cuidado possível. Nada foi de graça.;https://www.mercadolivre.com.br/console-playstation-5-slim-edico-digital-825-gb/p/MLB54963150
351;1;Indústria e Comércio;MLB50744235;Maquininha De Cartão Mercado Pago Point Pro 3 Tim 127/220v;109,20;4,9;5392;{'Operadora de cartão SIM': 'Tim'};Brasil;5;26/02/2026;Muito bom chegou rapido so demorei pra liga ela pois não sabia que tinha quer ir num lugar de sinal de rede e baixa atualização da maquininha e adiciona a conta.;https://www.mercadolivre.com.br/maquininha-de-carto-mercado-pago-point-pro-3/p/MLB50744235
352;2;Indústria e Comércio;MLB14815389;Máquina De Lavar Semi-automática Tanquinho Colormaq 10kg Prata 127v;541,49;4,8;15221;{'Cor': 'Prata', 'Voltagem': 'Escolha'};Brasil;5;25/05/2023;Minha esposa adorou,excelente.;https://www.mercadolivre.com.br/maquina-de-lavar-semi-automatica-tanquinho-colormaq-10kg-prata/p/MLB14815389
353;3;Indústria e Comércio;MLB4230644395;Bota Botina Segurança Trabalho Couro Resistente Epi Bico Pvc;46,88;4,5;2109;{'Cor': 'Preto', 'Tamanho': 'Escolha'};Brasil;5;24/12/2025;Sem texto;https://produto.mercadolivre.com.br/MLB-4230644395-bota-botina-seguranca-trabalho-couro-resistente-epi-bico-pvc-_JM
354;4;Indústria e Comércio;LBU3170970843;Maquininha De Cartão Mercado Pago Point Smart 2 4g Wifi Nfc Vivo;194,95;4,9;3404;{'Operadora de cartão SIM': 'Vivo'};Brasil;5;17/06/2025;Sem texto;https://www.mercadolivre.com.br/maquininha-de-cartao-mercado-pago-point-smart-2--4g-wifi-nfc/up/MLBU3170970843
355;5;Indústria e Comércio;MLB46422368;Cadeira De Escritório Suporte Lombar Dinâmico Python Fly Xhocb07 Cor Azul Material Do Estofamento Malha;557,00;4,6;4902;{'Cor': 'Azul'};Brasil;5;21/04/2025;Testada e aprovada!👍.;https://www.mercadolivre.com.br/cadeira-de-escritorio-suporte-lombar-dinmico-python-fly-xhocb07-cor-azul-material-do-estofamento-malha/p/MLB46422368
356;6;Indústria e Comércio;MLB37036888;Fita Dupla Face Ultrabond Fixa Forte 9mmx20m Transparente Liso;23,86;4,8;7262;{'Cor': 'Transparente', 'Dimensões': '0.9 cm x 20 m'};Brasil;5;10/09/2025;Gente essa fita e ótima pra colagem , prática , fácil de usar , barato , e vem bastante no rolo , comprem sem medo meu filho o negocio e bom demais so. Se eu conseguir te ajudar, da um laike 👍 pra mim saber se eu conseguir te ajudar, deus abençoe a todos brasileiros que estão lendo esse comentário. Eu recomendo a compra.;https://www.mercadolivre.com.br/fita-dupla-face-ultrabond-fixa-forte-9mmx20m-transparente/p/MLB37036888
357;7;Indústria e Comércio;MLB15579061;Liquidificador Daily Ri2110 Vermelho Philips Walita 127v;114,08;4,7;20650;{'Cor': 'Vermelho', 'Voltagem': 'Escolha'};Brasil;5;14/08/2023;Eu esperei alguns dias pra avaliar porque queria bater massa de bolo nele primeiro. E o desempenho dele foi muito bom, bateu direitinho, sem ficar todo quente igual o da mondial que eu tinha. O suco de laranja com beterraba também ele bateu bem melhor. O da mondial ainda ficava uns pedaços do bagaço, mas nesse não ficou nada. Show de bola. Adorei! quem estiver na dúvida, pode ir nele, sem medo.;https://www.mercadolivre.com.br/liquidificador-daily-ri2110-vermelho-philips-walita/p/MLB15579061
358;8;Indústria e Comércio;MLB25263136;Coala Spray Home Odorizante De Ambientes E Tecidos Chá Branco 260ml Aromatizante;27,99;4,9;4391;{};Brasil;5;06/12/2024;É uma fragrância bem forte, lembra até um perfume, e fixa por um bom tempo. A casa inteira fica perfumada! perfeito!!!.;https://www.mercadolivre.com.br/coala-spray-home-odorizante-de-ambientes-e-tecidos-cha-branco-260ml-aromatizante/p/MLB25263136
359;9;Indústria e Comércio;MLB36376232;Coala Essência Aromatizante Concentrado Alecrim 10ml;13,56;4,9;2230;{'Fragrância': 'Alecrim'};Brasil;5;17/08/2025;Só pra quem gosta de casa cheirosa !!!!.;https://www.mercadolivre.com.br/coala-essncia-aromatizante-concentrado-alecrim-10ml/p/MLB36376232
361;11;Indústria e Comércio;MLB22615810;Agulha HiPodérmica Descartável 20x0,55mm Medix Caixa Com 100 Unidades;15,99;4,9;6384;{};Brasil;5;02/07/2024;"Agulha muito boa. Excelente corte. Puxa normalmente a solução oleosa ""se é que vcs me entendem"" kkkkk. Se adequou perfeitamente à minha necessidade, que era fazer injeções de liquidos mágicos no glúteo kkkkk. Se vc tem um bom percentual de bf e não é tão ""cheinho"" e as aplicações forem no glúteo, ombro ou vasto lateral, essa agulha é ideal. Não fica rasa a aplicação do produto (ou seja subcutânea), e penetra no músculo. Agora se vc é gordinho ou tem muita gordura envolvendo o músculo, não vai te servir. Recomendo comprar uma maior, tipo 0,7x25. E lembrem-se sempre de calcular a quantidade de agulhas, observando que vc utiliza 2 por aplicação. Uma agulha para tirar do bujão e outra para aplicação. Nunca aplique com a mesma agulha que usou para retirar do bujão. Ela perde o corte e pode machucar bastante, além do risco de infecção.";https://www.mercadolivre.com.br/agulha-hipodermica-descartavel-20x055mm-medix-caixa-com-100-unidades/p/MLB22615810
362;12;Indústria e Comércio;MLB50744239;Maquininha De Cartão Mercado Pago Point Smart 2 - Chip Tim 127/220v;194,95;4,9;1038;{'Operadora de cartão SIM': 'Tim'};Brasil;5;01/03/2026;Gostei muito.;https://www.mercadolivre.com.br/maquininha-de-carto-mercado-pago-point-smart-2-chip-tim/p/MLB50744239
363;13;Indústria e Comércio;MLB55257632;Sacola Papel Pp 15x20x7cm 50und Feito Com Amor Acesso® Kraft Monolúcido Embalagem Presente Bolsa Ecológica Alça Torcida Marrom Corações;37,28;4,9;3535;{'Cor': 'Marrom', 'Nome do desenho': 'Corações', 'Unidades por kit': '50'};Brasil;5;21/09/2025;Achei bom, se for algo pesado precisa colar mais em baixo , coloquei meus produtos no lado pra vc se basear, eu achava que não caberia , serviu só não dá pra fechar muito ,mais pra começo tá ótimo,máximo 2 produtos, acima disso não dá, recomendo.;https://www.mercadolivre.com.br/sacola-papel-pp-15x20x7cm-50und-feito-com-amor-acesso-kraft-monolucido-embalagem-presente-bolsa-ecologica-alca-torcida/p/MLB55257632
364;14;Indústria e Comércio;LBU1140630285;10 Folhas Imã Manta Imantada Adesivada A4 0,3mm Preto Liso;33,17;4,9;2188;{'Cor': 'Preto'};Brasil;5;10/08/2024;Muito bom, atendeu minhas necessidades perfeitamente, cortando desse tamanho da foto pra fazer imã de geladeira c/ 10 folhas se consegue fazer uns 680 (2cmx5cm). Ficou bem colocado.;https://www.mercadolivre.com.br/10-folhas-ima-manta-imantada-adesivada-a4-03mm/up/MLBU1140630285
365;15;Indústria e Comércio;MLB65568800;Fita Demarcação De Solo Pvc 100 Mm X 30 Metros - Preta Preto;75,28;4,8;1020;{'Cor': 'Preto', 'Nombre do design': 'Preto', 'Dimensões': '30 m x 48 cm'};Brasil;4;04/06/2024;Ok.;https://www.mercadolivre.com.br/fita-demarcaco-de-solo-pvc-100-mm-x-30-metros-preta-preto/p/MLB65568800
366;16;Indústria e Comércio;MLB53367527;Kit 100 Un Sacolas Plásticas Boca Palhaço 30x40 Alça Vazada Cor Verde;54,90;4,7;7713;{'Cor': 'Verde'};Brasil;5;26/02/2023;Sacolas vieram bem embaladas. Trabalho com vendas de cosméticos e achei ótima! irei comprar novamente.;https://www.mercadolivre.com.br/kit-100-un-sacolas-plasticas-boca-palhaco-30x40-alca-vazada-cor-verde/p/MLB53367527
367;17;Indústria e Comércio;MLB35869236;Chaveiro Paracord Preto Com Mosquetão E Abridor De Garrafa Para Camping;22,99;4,7;4406;{'Cor': 'Preto', 'Nome do desenho': 'Liso'};Brasil;4;16/12/2024;É bonito, não parece que vai quebrar facilmente, mas ele veio com uma falha embaixo o que é bem chato porque deixou ele um pouco feio.;https://www.mercadolivre.com.br/chaveiro-paracord-preto-com-mosqueto-e-abridor-de-garrafa-para-camping/p/MLB35869236
368;18;Indústria e Comércio;MLB59191261;Papel De Parede Vinílico Autoadesivo 3d Para Banheiro, Cozinha E Quarto 10 M X 45 Cm Madeira Cerejeira;52,90;4,7;2010;{'Cor': 'Madeira Cerejeira'};Brasil;5;14/08/2025;"Muito legal. Eu mesma apliquei.
Achei que ficou muito bom o resultado e o material precisa ser fino mesmo, para que o acabamento fique mais realista, se fosse grosso não ficaria legal não. No preto, tive que colocar 2 camadas.";https://www.mercadolivre.com.br/papel-de-parede-vinilico-autoadesivo-3d-para-banheiro-cozinha-e-quarto-10-m-x-45-cm-madeira-cerejeira/p/MLB59191261
369;19;Indústria e Comércio;MLB41738663;Dispenser Porta Copo Descartável Parede Automatico 200ml Cor Branco;39,28;4,7;3363;{'Cor': 'Branco'};Brasil;5;23/10/2024;Muito bom só que não e igual o da logo.;https://www.mercadolivre.com.br/dispenser-porta-copo-descartavel-parede-automatico-200ml-cor-branco/p/MLB41738663
370;1;Informática;MLB50200776;Sony Playstation Store Gift Card R$ 100 (digital);100,00;5,0;39893;{'Crédito': 'R$ 100'};Brasil;5;07/06/2025;Excelente! a melhor maneira de colocar saldo na minha conta da psn.;https://www.mercadolivre.com.br/sony-playstation-store-gift-card-r-100-digital/p/MLB50200776
371;2;Informática;MLB65198110;Mouse Sem Fio Recarregável Wireless Optico Led Rgb Ergonômico Sem Fio Para Pc Desktop Notebook Tablet Smartphone Homeroarte Cinza;19,79;4,8;76390;{'Cor': 'Cinza'};Brasil;5;27/06/2025;"-eu diria que, pelo custo benefício, é um mouse 10/10.
-estou positivamente impressionado, portanto quero fazer uma avaliação mais completa para quem for, de fato, analisar as avaliações antes de comprar.
--- é simplesmente inacreditável como um mouse tão barato pode ser tão bom.
--- quero falar primeiro do ponto que mais me agradou, que é prático e incomum. O mouse vem com um switch na parte inferior com 3 posições: desligado ao centro, 'wi-fi' pra um lado (que usa o conector usb sem fio que vem com o produto) e bluetooth para o outro lado.
[[uso o usb sem fio plugado no computador que conecto na tv para assistir, e uso o bluetooth para conectar o mouse no meu computador principal. Com isso, basta alternar o switch para alternar em qual computador o mouse será usado]].
--- a precisão durante o uso é excelente, tanto no bluetooth quanto no conector usb, sem dificuldades para que o ponteiro chegue exatamente onde queremos.
--- o 'pressionar' dos botões principais é muito suave e silencioso. Somente o botão central (scroll), exige ser pressionado um pouquinho mais forte, mas coisa mínima.
--- aparência minimalista, com botões discretos, sendo parte da carcaça e não encaixes separados. Mouse bonito, sua luz de led não é muito forte e, apesar de não ser regulável, sempre se apaga enquanto o mouse está parado.
---lembrete: o termo ""wi-fi"" descrito no mouse não se trata da sua internet! portanto não se confundam antes de comprar. Esta é a conexão via plug usb sem fio---.";https://www.mercadolivre.com.br/mouse-sem-fio-recarregavel-wireless-optico-led-rgb-ergonmico-sem-fio-para-pc-desktop-notebook-tablet-smartphone-homeroarte-cinza/p/MLB65198110
372;3;Informática;MLB21644299;Papel Fotográfico Dupla Face Masterprint A4 220g 100 Folhas Branco;55,01;4,9;37126;{'Cor': 'Branco', 'Quantidade de folhas': '20', 'Gramagem': '220 g', 'Formato de venda': 'Kit', 'Unidades por kit': '20'};Brasil;5;01/08/2024;Comprei para usar na minha impressora epson l3250. Estava com medo de ser muito grosso e dar problema, porem me surpreendeu. Podem comprar sem medo!!!.;https://www.mercadolivre.com.br/papel-fotografico-dupla-face-masterprint-a4-220g-100-folhas/p/MLB21644299
373;4;Informática;MLB18917848;Controle Dualsense Cfi-zct1 Sem Fio Ps5 Galactic Purple;429,03;4,9;54997;{'Cor': 'Galactic purple'};Brasil;5;07/08/2023;Bonitão, bem mais bonito que o branco. Único ponto é que a bateria dura menos que o do ps4. Po mas também inventaram esse microfone no controle que o padrão é ligado, ninguém lembra de desligar isso e entrar numa partida de cod virou um pesadelo de sons aleatórios de novela cachorro latindo datena bebê chorando casal brigando panela de pressão e moto cortando giro na esquina.;https://www.mercadolivre.com.br/controle-dualsense-cfi-zct1-sem-fio-ps5-galactic-purple/p/MLB18917848
374;5;Informática;MLB25853444;Filamento Pla Verde Neon V-silk 1kg Impressão 3d Nacional;129,90;4,9;24854;{'Cor': 'Verde Neon V-Silk'};Brasil;5;16/03/2024;"Impressora creality ender 3 v3 se.
Temperatura do bico 230°c.
Temperatura da cama 65°c.
Configuração original da própria impressora. Utilizei o carretel inteiro e não tive problema algum. O resultado das peças é excelente.";https://www.mercadolivre.com.br/filamento-pla-verde-neon-v-silk-1kg-impresso-3d-nacional/p/MLB25853444
376;2;Instrumentos Musicais;MLB53924359;Caixa De Som Bluetooth À Prova D'água Boombox 4 Jbl - Preta Preto 127/220v;2603,07;4,9;7279;{'Cor': 'Preto'};Brasil;5;12/09/2025;"Essa boombox me surpreendeu. Já tive a 1, tenho a 3 e agora a 4, e posso falar que essa é a melhor de todas. Ela é maior, mais robusta e mais leve.
Se eu recomendo? com certeza, os graves dela são melhores que a 3 e tem um som bem mais alto, 30% de volume nela com o bass boost ativado equivale a 50 a 60% da 3 com o grave equalizado no máximo. Na boombox 4 seu pico de grave acaba com uns 60%, depois é só aumento de agudos, desligue o bass boost e ela vira uma boombox 3 só que bem mais alta. 70% dela equivale a 100% da bb3. Não consegui chegar em 100% na bb4 dentro de casa.";https://www.mercadolivre.com.br/caixa-de-som-bluetooth-prova-dagua-boombox-4-jbl-preta/p/MLB53924359
377;3;Instrumentos Musicais;MLB27196801;Suporte De Parede Violão Guitarra Violino Baixo Ukulele Acolchoado Com Parafusos Preto;19,00;4,8;8556;{'Cor': 'Preto'};Brasil;5;20/01/2024;"Suporte de fácil instalação e bom custo benefício, suportaram bem o peso dos meus instrumentos.
Só indico que não utilizem a bucha e parafusos inclusos no pacote de 6mm. Coloquei buchas e parafusos de 8mm e ficaram bem firmes na sustentação do suporte. Recomendo!.";https://www.mercadolivre.com.br/suporte-de-parede-violo-guitarra-violino-baixo-ukulele-acolchoado-com-parafusos/p/MLB27196801
379;5;Instrumentos Musicais;MLB26408339;Pandeiro Profissional Izzo Pele Preta 10 Corpo Abs 6480 Cor Preto;50,77;4,8;6553;{'Cor': 'Preto'};Brasil;5;05/07/2024;Pandeiro muito bom to aprendendo tocar hino da harpa o som sai muito bonito dele amei.;https://www.mercadolivre.com.br/pandeiro-profissional-izzo-pele-preta-10-corpo-abs-6480-cor-preto/p/MLB26408339
380;6;Instrumentos Musicais;MLB53807263;Jogo Cordas Violão Nylon Giannini Genw 5921 Canário 6 Cordas 0.028-0.043;24,57;4,8;1683;{};Brasil;5;08/11/2025;Não tem oq falar, qualidade giannini é ótima sonoridade perfeita, veio uma palheta de brinde.;https://www.mercadolivre.com.br/jogo-cordas-violo-nylon-giannini-genw-5921-canario-6-cordas-0028-0043/p/MLB53807263
381;7;Instrumentos Musicais;LBU1474179527;Kit 5 Pares De Baquetas De Bateria Profissional Vanguarda Madeira 7a;39,99;4,7;2662;{'Cor': 'Madeira', 'Tamanho': '7A'};Brasil;4;07/06/2025;Comprei muito arriscando em ser boa ou ruim. Porém superou oq eu esperava são top leves no padrão. Já comprei de marcas e mandeira ricory que não aguento nada porém essa é barata e não sei se a madera é boa mais o importante ela faz que é aguentar a mão é o instrumento indico a compra sem medo.;https://www.mercadolivre.com.br/kit-5-pares-de-baquetas-de-bateria-profissional-vanguarda/up/MLBU1474179527
382;8;Instrumentos Musicais;LBU3382704561;Microfone Lapela Sem Fio Duplo C/ Imã Antirruído Com Anatel Preto;99,07;4,9;590;{'Cor': 'Preto'};Brasil;5;20/12/2025;Sem sombra de dúvidas a melhor compra. Não tenham receio de adquirir, pois o produto tem qualidade e de fato aquilo que promete e que vemos nos vídeos demonstrativos são realidade. Estou satisfeito com o produto.;https://www.mercadolivre.com.br/microfone-lapela-sem-fio-duplo-c-ima-antirruido-com-anatel/up/MLBU3382704561
384;10;Instrumentos Musicais;MLB22640230;Cabo Santo Angelo Ninja Guitarra Violão Baixo P10 - 6,1 Metros;66,95;4,9;5643;{'Cor': 'Preto', 'Comprimento do cabo': '6.1 m'};Brasil;5;04/06/2023;Produto maravilhoso. Conectores super resistentes. O início do cabo possui uma proteção de borracha, dando mais resistência. Recomendo.;https://www.mercadolivre.com.br/cabo-santo-angelo-ninja-guitarra-violo-baixo-p10-61-metros/p/MLB22640230
385;11;Instrumentos Musicais;MLB24572042;Microfone Fifine Usb/xlr Am8 Dinâmico Cardioide Cor Preto;279,51;4,9;3205;{'Cor': 'Preto'};Brasil;5;09/11/2023;Um ótimo produto, custo beneficio com qualidade bem acima do esperado, pode comprar sem medo que ele vai chegar. O input e o output é perfeito pra o que preciso.;https://www.mercadolivre.com.br/microfone-fifine-usbxlr-am8-dinmico-cardioide-cor-preto/p/MLB24572042
386;12;Instrumentos Musicais;MLB21604979;Jogo De Cordas Nylon Para Violão Giannini Canário C/ Bolinha;21,00;4,8;5275;{'Unidades por kit': '1'};Brasil;4;26/08/2023;A mizinha tem que afinar bem devagar, afina um tom e espera um pouco antes de afinar o próximo, caso contrário estoura.;https://www.mercadolivre.com.br/jogo-de-cordas-nylon-para-violo-giannini-canario-c-bolinha/p/MLB21604979
387;13;Instrumentos Musicais;MLB23159037;Cabo Audio P2 Para P10 Estereo Dj Fone Blindado 50cm Vention;29,93;4,8;5424;{'Cor': 'Preto', 'Comprimento do cabo': '50 cm'};Brasil;5;16/01/2024;Produto excelente, tenho 2, uso um a bastante tempo, nunca tive problema, o outro é apenas reserva, recomendo de olho fechado.;https://www.mercadolivre.com.br/cabo-audio-p2-para-p10-estereo-dj-fone-blindado-50cm-vention/p/MLB23159037
388;14;Instrumentos Musicais;LBU3302147022;Estante Partitura Suporte Pasta Musica Dobrável Com Bolsa Preto;35,19;4,9;149;{'Cor': 'Preto'};Brasil;4;07/03/2026;Ótimo produto. Fácil de montar e desmontar, boa qualidade. Ajusta na altura, tanto no pezinho quanto na parte de cima. Também é regulável a inclinação. Pontos de melhoria: achei a bandeja pequena, serve para poucaa folhas ou pastas finas, mas se sua partitura está em pastas catálogo com capa fica escorregando. Também incomoda o apoio que segura a pasta. É pequeno e inclinado para baixo, o que não facilita quando a partitura é mais grossa. Mas no geral atende bem.;https://www.mercadolivre.com.br/estante-partitura-suporte-pasta-musica-dobravel-com-bolsa/up/MLBU3302147022
389;15;Instrumentos Musicais;MLB50030282;Capotraste Violao Aço Nylon Guitarra Cavaco Ukulele Baixo Preto;19,00;4,8;2764;{'Cor': 'Preto'};Brasil;4;20/07/2025;"Produto bom, mas não me serviu.
O capotraste é específico para guitarra e violão elétrico ( isso deveria estar especificado pelo comprador ) , é mais curto ,por isso não consegui usar no meu clássico ,com cordas de nylon.";https://www.mercadolivre.com.br/capotraste-violao-aco-nylon-guitarra-cavaco-ukulele-baixo/p/MLB50030282
390;16;Instrumentos Musicais;MLB44539781;15 Placas Espuma Acústica Lisa 50x50x5cm Antichama 3,75m2 Cor Cinza-escuro;278,35;4,7;1296;{'Cor': 'Cinza-escuro', 'Unidades por kit': '15'};Brasil;4;16/06/2025;Comprei um lote de 240 espumas solicitando a cor preta e não veio pradonizado, cor e tamanho.;https://www.mercadolivre.com.br/15-placas-espuma-acustica-lisa-50x50x5cm-antichama-375m2-cor-cinza-escuro/p/MLB44539781
391;17;Instrumentos Musicais;LBU768532205;Capa Bag Para Violão Case Clássico Folk Alça Dupla;48,89;4,6;6621;{};Brasil;4;07/08/2023;Produto bom, simples e eficiente, é indicado para quem quer apenas uma bag para guardar o instrumento em casa mesmo. Não é acolchoada, nem reforçada, por isso para certos transportes acho que vale a pena pegar algo melhor. Mais para guardar em casa mesmo e levar para um lugar ou outro em situações esporádicas, está ok pelo valor.;https://www.mercadolivre.com.br/capa-bag-para-violao-case-classico-folk-alca-dupla/up/MLBU768532205
392;18;Instrumentos Musicais;MLB21632947;Encordoamento Giannini Cobra 010 P/ Violão Aço;30,00;4,8;7921;{'Unidades por kit': '6'};Brasil;5;07/11/2023;Pode comprar que é bom. Sempre compro pra igreja em que congrego e a qualidade é muito boa pelo valor investido.;https://www.mercadolivre.com.br/encordoamento-giannini-cobra-010-p-violo-aco/p/MLB21632947
393;19;Instrumentos Musicais;LBU3564393235;Afinador Digital Cromático Clip Violão Viola Guitarra Cavaco Preto;26,90;4,7;655;{'Cor': 'Preto'};Brasil;4;08/02/2026;"Úncia coisa ruim, que véio falta do o parafuso aonde coloca a bateria.
Aí vou ter que arrumar para adaptar, mas de resto véio tudo certo, está funcionando bem.";https://www.mercadolivre.com.br/afinador-digital-cromatico-clip-violao-viola-guitarra-cavaco/up/MLBU3564393235
394;20;Instrumentos Musicais;MLB27058203;Caixa De Flauta Yamaha 10 Pz Soprano C School Fresco Yrs-24b Osso;399,00;4,9;3881;{'Cor': 'Osso'};Brasil;5;24/03/2024;Otimo , uma flauta e um sonho faz a diferença em este mundo.;https://www.mercadolivre.com.br/caixa-de-flauta-yamaha-10-pz-soprano-c-school-fresco-yrs-24b/p/MLB27058203
395;1;Joias e Relógios;MLB34212375;Pulseira De Silicone Para Relógio Smartwatch 42mm 44mm 45mm Cor Azul-turquesa;21,09;4,7;1163;{'Cor': 'Azul-turquesa', 'Medidas de la malla': '150 mm x 4.4 cm'};Brasil;4;15/04/2025;Produto bom, qualidade dos materiais razoável mas dentro do esperado pelo preço pago. Única coisa que me incomodou foi que o encaixe da pulseira no relógio ficou com uma pequena “sobra” nas laterais, mas nada que chame muito a atenção.;https://www.mercadolivre.com.br/pulseira-de-silicone-para-relogio-smartwatch-42mm-44mm-45mm-cor-azul-turquesa/p/MLB34212375
396;2;Joias e Relógios;MLB17403342;Relógio De Pulso Digital Skmei 1251 Com Corria De Poliuretano Cor Preto - Bisel Marrom;59,94;4,8;13946;{'Correia': 'Preto de Poliuretano', 'Cor do bisel': 'Marrom'};Brasil;5;18/04/2023;"Estou a menos de 1 semana mas esse relógio é ótimo, comprei pelo tamanho do indicador de segundos, que nos relógios costumam ser menores, ainda sim não é como a imagem mostrar, esse não é o modelo skmei 1251 é o modelo skmei 1257 para quem ter curiosidade e compare as fotos do anúncio com as minhas, ou seja, anúncio está errado. Sobre o relógio manual está em inglês e chinês mas nada que um tradutor que tenha função de traduzir por foto e alguns testes e você saberá exatamente o que fazer. Esse relógio me surpreendeu por ter além da função relógio que é dividida em 2, no qual uma é sempre 24 horas (dual time), e a outra que é a principal onde pode escolher entre ter sistema de 12 horas (1 á 12, variando de am e pm) ou de 24 horas. Além de ter alarme, onde dá para ativar ou desativar ele e o modo soneca que também é ativável/desativável e o cronômetro e também o timer. Além de ter a luz noturna que parece ser de 1 segundo. As funções funcionam bem e os botões parece que durarão bons meses (pra dizer anos só testando), tome cuidado o visor parece ser fácil de riscar, tem proteção contra água mas não recomendo entrar em água do mar (salina), nem de piscina, também não deve ser entrar de água quente de chuveiro. Dá para entrar mas correr o risco de diminuir a vida útil do aparelho. Esse relógio é a bateria cr2032.
Por ser um relógio desse preço para mim parece ser uma boa escolha que com cuidado pode durar anos.";https://www.mercadolivre.com.br/relogio-de-pulso-digital-skmei-1251-com-corria-de-poliuretano-cor-preto-bisel-marrom/p/MLB17403342
397;3;Joias e Relógios;MLB18347134;Relógio Garmin Forerunner 55 Monitor Cardíaco E Gps 42mm Black Mesh Black Preto;1169,00;4,9;2889;{'Cor': 'Black', 'Material da caixa do smartwatch': 'Polímero reforçado'};Brasil;5;21/10/2023;Testei uns dias para conseguir ter uma opinião sobre o produto. Os relógios da garmin são excelentes. O forerunner 55 é um relógio de entrada, tem um valor um pouco elevado comparado a outros de entrada no mercado. Mas, vamos lá, estou usando tem uns 5 dias, fazendo atividade física diariamente e, não tive necessidade de carrega-lo, o, que me agrada. Sobre as sua funcionalidades, tudo muito intuitivo , bem fácil de usar, desde a escolha do exercício ao acompanhamento do batimento cardíaco. Estou satisfeita com meu relógio.;https://www.mercadolivre.com.br/relogio-garmin-forerunner-55-monitor-cardiaco-e-gps-42mm-black-mesh-black-preto/p/MLB18347134
