Posição Global;Posição Categoria;Subcategoria;ASIN;Nome;Preço à vista;Nota Geral;Qtd. Avaliações;Caractéristicas;País;Nota Comentário;Data Comentário;Comentário;Link
95;5;Bebês;MLB19315994;Shampoo Estimulante Tratamento Antiqueda Para Cabelos Fracos E Quebradiços, Fortalece Os Fios Com Aminexil, Niacinamida E Vitamina E, Dercos Energy+ Vichy 400g;102,20;4,8;24236;{'Apresentação': 'Dosador', 'Conteúdo total em volume': '400 mL', 'Conteúdo total em peso': '400 g'};Brasil;5;25/08/2023;"Amei já na primeira lavada senti diferença no toque!.
A cutícula ficou alinhada e o cheiro é muito gostoso!.
Eu comprei sachê e coloquei num frasco já lavado de shampoo do meu bebê!🥰.
Depois do covid19 (2020) nunca mais o meu cabelo parou de cair.
Espero que agora pare! 🙏🏻.";https://www.mercadolivre.com.br/shampoo-estimulante-tratamento-antiqueda-para-cabelos-fracos-e-quebradicos-fortalece-os-fios-com-aminexil-niacinamida-e-vitamina-e-dercos-energy-vichy-400g/p/MLB19315994
96;6;Bebês;MLB19734681;Sabonete Em Barra Natura Tododia Capim Limão E Hortelã 5un 90g;28,61;4,9;8509;{};Brasil;5;29/09/2025;"Um dos melhores sabonetes, perfumado, sabonete e da natura!!.
Testado e aprovado!.";https://www.mercadolivre.com.br/sabonete-em-barra-natura-tododia-capim-limo-e-hortel-5un-90g/p/MLB19734681
97;7;Bebês;MLB36372784;Kit 8 Peças Introdução Alimentar Infantil Conjunto Papinha Pratinho Silicone Cor Rosa-chiclete;40,99;4,8;8929;{'Cor': 'Rosa-chiclete'};Brasil;5;26/12/2024;Eu gostei, veio completo! tudo em silicone, a minha neném está começando agora a introdução alimentar, mas deixo ela pegando as coisas, ainda bem que ele prende na mesinha, porque ela fica tentando jogar o prato no chão!.;https://www.mercadolivre.com.br/kit-8-pecas-introduco-alimentar-infantil-conjunto-papinha-pratinho-silicone-cor-rosa-chiclete/p/MLB36372784
98;8;Bebês;MLB14682438;Luvas Nitrílicas Azuis Talge Antiderrapantes Tamanho M Kit 10x100 Unidades Azul;329,90;4,8;23898;{'Cor': 'Azul', 'É antiderrapante': 'Sim', 'Tamanho': 'M'};Brasil;5;30/07/2023;"Gostei do produto.
Uma dica: para quem está acostumado com luva de látex, e vai comprar nitrílica, aconselho a comprar um tamanho maior do que utiliza em látex (por o látex possuir a propriedade elástica maior que o nitrilo. ).
Bem resistente e bonita. A partir de agora só irei utilizar luvas nitrílicas (tatuador).";https://www.mercadolivre.com.br/luvas-nitrilicas-azuis-talge-antiderrapantes-tamanho-m-kit-10x100-unidades/p/MLB14682438
99;9;Bebês;MLB18643759;Fralda Pampers Premium Care Pants Tamanho M 78 Unidades Sem Gênero;104,90;4,9;6579;{'Tamanho': 'M', 'Fraldas por pacote': '78'};Brasil;5;28/02/2025;Ostentação para uma mãe é poder comprar uma fralda boa com filho sabe na minha outra gestação nunca tive condição para comprar uma fralda para o meu filho e nessa deus também abençoando e eu tô comprando sabe só tenho que agradecer.;https://www.mercadolivre.com.br/fralda-pampers-premium-care-pants-tamanho-m-78-unidades/p/MLB18643759
100;10;Bebês;MLB38708858;Sabão Em Barra Dove Sabonetes De 90 G 8 U Pacote X 24;179,99;4,9;8541;{'Unidades por kit': '24', 'Unidades': '8'};Brasil;5;20/04/2024;O pacote veio com produtos de limpeza misturado aos alimentos, quando deveriam estar separados ou pelo menos isolados.;https://www.mercadolivre.com.br/sabo-em-barra-dove-sabonetes-de-90-g-8-u-pacote-x-24/p/MLB38708858
101;11;Bebês;MLB17335766;Fraldas Pampers Supersec Xxg 64 Unidades Xgg Sem Gênero;199,90;4,8;24993;{'Tamanho': 'XGG', 'Fraldas por pacote': '64', 'Quantidade de pacotes': '1'};Brasil;5;22/10/2023;"Comprarmos, porém ficamos com algumas dúvidas, pois nós comentários estava bem divido, uns falando bem e outros mal.
No meu caso, eu gostei, serviu bem no meu filho, a durabilidade é boa. Ficou a noite toda, e não vazou, porém isso é uma coisa que acho que os pais tem que ter consciência que pode várias de crianças, tem crianças que fazem mais xixi a noite, e outras não, um dos meus filhos mesmo, já aconteceu de as vezes ele fazer xixi só de manhã, e faz bastante. Se tiver promoção novamente irei comprar sem medo agora. Fraldas são muitos boas.";https://www.mercadolivre.com.br/fraldas-pampers-supersec-xxg-64-unidades/p/MLB17335766
102;12;Bebês;MLB46443884;Grade Portão Porta Proteção Pets Crianças C/ Extensor Cor Branco Aramado 69cm;63,99;4,7;17866;{'Cor': 'Branco', 'Altura total': '69 cm', 'Largura máxima': '83 cm'};Brasil;4;21/09/2023;Comprei por causa dos meus filhotes shitszu, e não resolveu muito coisa não kkk, pq eles passam pela grade , tive q fazer uma adaptação , e eles escalam o portão kkk , são demais. Mas o portão é bom , para mim teria q ser um pouco mais fechado e alto, acredito q outro modelo.;https://www.mercadolivre.com.br/grade-porto-porta-proteco-pets-criancas-c-extensor-cor-branco-aramado-69cm/p/MLB46443884
103;13;Bebês;LBU3189489365;Suporte Babá Eletrônica Compatível Cãmera Vb603 Base 7 Cm Branco;19,10;4,8;1850;{'Cor': 'Branco'};Brasil;4;22/10/2025;O suporte serviu certinho para minha babá eletrônica, tanto o encaixe para câmera quanto para o berço. Aprovado a compra! se a câmera babá eletrônica de vocês for a vb603 vai da certinho, igual a minha. Coloquei umas fotos da câmera encaixada no suporte e o suporte sozinho e ele no berço. Espero te ajudado, se eu te ajudei deixe uma curtida.;https://www.mercadolivre.com.br/suporte-baba-eletronica-compativel-camera-vb603-base-7-cm/up/MLBU3189489365
104;14;Bebês;MLB17335933;Fralda Pampers Confort Sec Xxg 60 Unidades Sem Gênero;110,52;4,9;30103;{'Tamanho': 'XXG', 'Fraldas por pacote': '60'};Brasil;5;04/07/2023;Pampers é pampers, nem precisa de comentários!!!.;https://www.mercadolivre.com.br/fralda-pampers-confort-sec-xxg-60-unidades/p/MLB17335933
105;1;Beleza e Cuidado Pessoal;MLB25904875;Creme Reparador Cicaplast Baume B5+ 20ml La Roche-posay;36,99;4,9;63790;{'Volume': '20 mL'};Brasil;5;15/12/2023;Muitas pessoas comentando que o produto não é original. Vcs já viram que a loja que vende é a própria la roche posay? é claro que é original. Já é o quinto tubinho que eu compro e eu adoro. Melhor hidratante facial do mundo!.;https://www.mercadolivre.com.br/creme-reparador-cicaplast-baume-b5-20ml-la-roche-posay/p/MLB25904875
106;2;Beleza e Cuidado Pessoal;MLB16084410;Papel Higiênico Neve Toque Da Seda Folha Dupla 30 M De 4 Un;14,39;4,9;19196;{'Unidades por pacote': '4'};Brasil;4;10/03/2024;Fala que é folha dupla mas é super fino. Com certeza não é como os de antigamente, a qualidade do papel neve caiu nesse quesito. Se quiser o antigo folha dupla, compre o folha tripla.;https://www.mercadolivre.com.br/papel-higinico-neve-toque-da-seda-folha-dupla-30-m-de-4-un/p/MLB16084410
107;3;Beleza e Cuidado Pessoal;MLB18392802;Pack Toalha Umedecida Disney Baby Huggies Max Clean Pacote 4 Unidades Leve Mais Pague Menos;39,99;4,9;10734;{};Brasil;5;27/02/2025;Não tem o que falar! muito bom! uso pra limpar o painel do carro e limpar tênis branco, não tenho filho, não achei a mulher da minha vida ainda, se você está solteira me liga.;https://www.mercadolivre.com.br/pack-toalha-umedecida-disney-baby-huggies-max-clean-pacote-4-unidades-leve-mais-pague-menos/p/MLB18392802
108;4;Beleza e Cuidado Pessoal;MLB45519277;Body Splash Delight Barbour's Beauty Cedro Peônia Líchia 200ml;48,21;4,6;6389;{};Brasil;5;06/06/2025;Amei o aroma apesar de achar suave. Mas deve se levar em consideração que ele é body splash. Não perfume! de fato passei ontem a noite e o cheiro tá aqui ainda hj. Excelente fixação.;https://www.mercadolivre.com.br/body-splash-delight-barbours-beauty-cedro-penia-lichia-200ml/p/MLB45519277
109;5;Beleza e Cuidado Pessoal;MLB35848144;Maquina Maquininha De Cortar Cabelo Barbeador Eletrico Aparador De Pelos Acabamento Dragão Buda Profissional Kamufla Dourado 127/220v;22,90;4,4;97334;{'Cor': 'Dourado'};Brasil;5;06/10/2024;Produto de excelente qualidade prático custo-benefício com relação as fotos não há necessidade o produto já fala por si é uma das compras que tem feito no mercado livre que me trouxe satisfação parabéns pastor roberto costa.;https://www.mercadolivre.com.br/maquina-maquininha-de-cortar-cabelo-barbeador-eletrico-aparador-de-pelos-acabamento-drago-buda-profissional-kamufla/p/MLB35848144
110;6;Beleza e Cuidado Pessoal;LBU2980829097;Gloss Fran By Franciny Ehlke Liphoney Mel Liphoney-mel;27,49;4,8;3961;{'Color': 'LIPHONEY-MEL'};Brasil;5;21/05/2025;Comprei pra minha namorada, mas antes de chegar ela terminou comigo, isso foi um azar, não compro mais não, ainda tem um perfume que comprei pros dias dos namorados que tá pra chegar, o jeito vai ser revender.;https://www.mercadolivre.com.br/gloss-fran-by-franciny-ehlke-liphoney-mel/up/MLBU2980829097
111;7;Beleza e Cuidado Pessoal;MLB45617876;Attracione Men Perfume Masculino Com Feromônios Ativados 25 Ml;69,00;4,4;43363;{};Brasil;4;07/03/2025;O perfume é bom, copia do scandal, nada de mais, e nao, a mulherada nao vai sair pulando em cima de ti kkk.;https://www.mercadolivre.com.br/attracione-men-perfume-masculino-com-feromnios-ativados-25-ml/p/MLB45617876
112;8;Beleza e Cuidado Pessoal;MLB19380755;Nautica Tradicional Voyage Clasico Edt 200ml Para Masculino;189,25;4,8;18165;{'Volume da unidade': '200 mL'};Brasil;4;17/08/2023;Pensei que o cheiro marinho ficasse mais escondido, como algumas pessoas falaram, e youtubers também. Mas é muito nítido, lembrando cheiros comuns como avon musk marine. Embora depois de um tempo ele amenize pra algo furado cítrico bem leve. Não me impressionou. Embora seja original, eu não comprarei mais. Mas confirmo que é bem cheiroso pra maioria e não desagrada, é um cheiro comum demais, por isso só dei 4 estrelas.;https://www.mercadolivre.com.br/nautica-tradicional-voyage-clasico-edt-200ml-para-masculino/p/MLB19380755
113;9;Beleza e Cuidado Pessoal;MLB18646868;Floratta Simple Love Desodorante Colônia 75ml Volume Da Unidade 75 Ml;99,90;4,8;1098;{};Brasil;5;24/12/2023;Foi a primeira vez que comprei, não é meu cheiro favorito, mas é cheiroso e dura bastante.;https://www.mercadolivre.com.br/floratta-simple-love-desodorante-colnia-75ml-volume-da-unidade-75-ml/p/MLB18646868
114;10;Beleza e Cuidado Pessoal;MLB18638651;Secador De Cabelos, Mondial, 2000w - Scn-01 Preto/violeta 127v;119,90;4,7;25471;{'Cor': 'Preto/Violeta', 'Voltagem': 'Escolha'};Brasil;5;24/10/2024;Oiiii gente o produto é ótimo!!!! eu ameiiiiiii podem comprar, chega super rápido. Curtam meu comentário por favorrrrr.;https://www.mercadolivre.com.br/secador-de-cabelos-mondial-2000w-scn-01/p/MLB18638651
115;11;Beleza e Cuidado Pessoal;MLB19600322;Creme Hidratante Para Pele Seca E Extra Seca Com 3 Ceramidas E Ácido Hialurônico Hidratação 48h Cerave 50g;28,71;4,9;46109;{'Tipo de embalagem': 'Bisnaga', 'Peso da unidade': '50 g'};Brasil;5;23/11/2022;Esse hidratante é maravilhoso. A pele fica muito macia. Uso no rosto também (ele também é para o rosto) e notei q ele hidrata e uniformiza muito a pele do rosto. Tenho a impressão de que melhorou até linhas leves e manchas.;https://www.mercadolivre.com.br/creme-hidratante-para-pele-seca-e-extra-seca-com-3-ceramidas-e-acido-hialurnico-hidrataco-48h-cerave-50g/p/MLB19600322
116;12;Beleza e Cuidado Pessoal;LBU3265279445;Aparelho Lixa Pés Elétrico Esfoliante Removedor De Calos Usb 110v/220v;19,31;4,5;5223;{};Brasil;5;04/09/2025;Sem texto;https://www.mercadolivre.com.br/aparelho-lixa-pes-eletrico-esfoliante-removedor-de-calos-usb/up/MLBU3265279445
117;13;Beleza e Cuidado Pessoal;MLB21361292;Loção Hidratante Corporal Sem Perfume, Com Ceramidas Essenciais E Ácido Hialurônico, Textura Fluida Cerave 473ml Sem Fragrância;89,99;4,9;73219;{};Brasil;5;25/04/2023;Eu sou apaixonado por essa loção e pela linha toda da cerave! ela me ajudou muito na melhora da minha pele, pois tive dermatite e precisava de algo que não me causasse alergias mas que hidratasse de uma forma rápida mas que fosse duradoura! comecei a usar o creme da cerave de início e agora que já estou melhor só uso a loção! a textura dele é leve, fácil de passar e com um cheiro suave e agradável que logo se dissipa…. Hidrata muito bem a pele do corpo e rosto! o preço realmente é alto, mas se tratando de algo de qualidade dermatológica vale super a pena! não vivo mais sem e super recomendo!.;https://www.mercadolivre.com.br/loco-hidratante-corporal-sem-perfume-com-ceramidas-essenciais-e-acido-hialurnico-textura-fluida-cerave-473ml/p/MLB21361292
118;14;Beleza e Cuidado Pessoal;MLB43444252;Principia Kit Primeira Rotina C/ Gl-02 + Ah-2 + Ps-01 Fps60;111,72;4,9;10544;{};Brasil;5;06/02/2025;Sem erro, combo ótimo pra quem tá querendo um produto bom e barato. Minha esposa teve uma considerável diminuição de algumas manchas no rosto, com um mês de uso, e comecei a usar também.;https://www.mercadolivre.com.br/principia-kit-primeira-rotina-c-gl-02-ah-2-ps-01-fps60/p/MLB43444252
119;15;Beleza e Cuidado Pessoal;MLB18390579;Cetaphil Creme Hidratante Corporal 453g | Pele Sensível, Normal A Seca | Hidratação 48h | Niacinamida E Pantenol (pró-vitamina B5) Neutra;99,90;4,9;47175;{};Brasil;5;13/08/2023;"Amo esse hidratante! porém fiquei decepcionada com essa última compra. O produto veio dentro da caixa embaladinho , até aí ""ok"", quando abri a caixa que veio a surpresa! simplesmente o lacre de segurança estava rompido e com certeza o pote foi aberto pq o lacre estava oposto um do outro, como vê na foto. Uma parte do lacre estava de um lado e a outra parte do outro lado. Fiquei muito triste com isso. E fiquei com dúvida se seria um produto horiginal ou imitação. Confesso que fiquei decepcionada com isso.";https://www.mercadolivre.com.br/cetaphil-creme-hidratante-corporal-453g-pele-sensivel-normal-a-seca-hidrataco-48h-niacinamida-e-pantenol-pro-vitamina-b5/p/MLB18390579
120;16;Beleza e Cuidado Pessoal;MLB19755099;Protetor Solar Facial Antioleosidade Fps80 Controle De Oleosidade Efeito Matte Cobertura Uniforme Toque Seco Sem Cor Anthelios Airlicium La Roche-posay 40g;78,19;4,9;30086;{};Brasil;5;19/07/2024;Percebi a diferença já na primeira semana.;https://www.mercadolivre.com.br/protetor-solar-facial-antioleosidade-fps80-controle-de-oleosidade-efeito-matte-cobertura-uniforme-toque-seco-sem-cor-anthelios-airlicium-la-roche-posay-40g/p/MLB19755099
121;17;Beleza e Cuidado Pessoal;MLB24027627;Prancha Lizze Chapinha Profissional 480 Extreme Cinza 127v;380,37;4,8;32597;{'Cor': 'Cinza', 'Voltagem': 'Escolha'};Brasil;5;14/07/2024;É fantásticaaaa maravilhosaaa ❤️❤️❤️. Esquenta muito muito rápido, fiz a progressiva soninha e ficou perfeito o meu cabelo, recomendo muito 🥰🥰🥰.;https://www.mercadolivre.com.br/prancha-lizze-chapinha-profissional-480-extreme/p/MLB24027627
122;18;Beleza e Cuidado Pessoal;LBU3555982525;Máquina De Acabamento Corta Cabelo Profissional Kemei 2299 P Preto 127/220v;84,00;4,9;4346;{'Cor': 'Preto'};Brasil;5;11/11/2023;"Máquina muito boa, design bonito e a maquina é confortável de usar.
Atenção a um detalhe, a máquina vem com a regulagem baixa de mais, tive que regular porque estava arrancando os cabelos na raiz kkkk após a regulagem ficou perfeita, parece que usei gilete.";https://www.mercadolivre.com.br/maquina-de-acabamento-corta-cabelo-profissional-kemei-2299-p/up/MLBU3555982525
123;19;Beleza e Cuidado Pessoal;MLB39666419;Quasar Ice Deo Colônia Fougère Aldeídica 100ml Boticário Masculino;129,00;4,9;1147;{};Brasil;4;14/02/2025;"O quasar ice tem uma fragrância agradável e marcante, proporcionando uma sensação de frescor e limpeza que dura ao longo do dia. No início, há um cheiro perceptível de álcool, mas ele evapora rapidamente, deixando apenas o aroma cativante.
Para quem busca um desodorante colônia com boa fixação e um perfume envolvente, vale a pena experimentar. No entanto, não sou especialista para avaliar sua autenticidade, então recomendo pesquisar um pouco mais antes da compra. No meu caso, não me arrependo da escolha.";https://www.mercadolivre.com.br/quasar-ice-deo-colnia-fougere-aldeidica-100ml-boticario-masculino/p/MLB39666419
124;1;Brinquedos e Hobbies;MLB52133137;Caminhão Dinossauro Pista Com Carrinhos Maleta Transporte Cor Verde;118,00;4,9;2767;{'Cor': 'Verde'};Brasil;5;08/10/2025;Pessoal que compra seria bom posta pra quem quer compra tirar suas dúvidas, comprei pelo valor de 119 reais dizem. Qie e promoção mas so vem 2 carrinhos ,e veio faltando uma peça que supostamente seria a pata dele !porém é melhor compra pelo valor de 200 reais e vem mais opções de carrinhos. Meu filho gostou bastante.;https://www.mercadolivre.com.br/caminho-dinossauro-pista-com-carrinhos-maleta-transporte-cor-verde/p/MLB52133137
125;2;Brinquedos e Hobbies;MLB39369748;Bicicleta De Equilíbrio 4 Rodas Buba Retro Sem Pedal Verde;197,00;4,9;18573;{'Cor': 'Verde'};Brasil;5;17/11/2024;"Gosto sempre de avaliar pois através da avaliação de outras pessoas eu faço minhas compras.
Então vamos lá….
A bicicleta é recomendada para crianças a partir de 1 ano.
Meu filho tem 1 ano e 4 meses e já na segunda semana usando ele se adaptou.
Achei muito legal a evolução dele em tão pouco tempo.
A bicicleta é realmente pequena mas claramente ela ajuda a criança a ter mais equilíbrio e noção de espaço.
Super recomendo e antes que esqueça, ela é super fácil de montar.";https://www.mercadolivre.com.br/bicicleta-de-equilibrio-4-rodas-buba-retro-sem-pedal-verde/p/MLB39369748
126;3;Brinquedos e Hobbies;MLB44707055;Bicicleta De Equilíbrio Sem Pedal 4 Rodas Mega Compras Cor Menta Verde Conect Brinq Mc938 Verde Menta;59,90;4,7;5410;{'Cor': 'Verde menta'};Brasil;5;30/12/2024;O material é algum tipo de metal que consegue ser resistente e leve ao mesmo tempo. Meu filho de 1 ano e 4 meses consegue levantar a bicicleta sem dificuldade. Montei rápido, coisa de 5 minutos. Considero segura por não possuir partes perigosas expostas (como pontas, lâminas ou serras), o que é crucial pra um brinquedo de crianca. O selin poderia ser ajustável (como o guidão é), é a única coisa que eu mudaria no produto. De resto é ótimo! vale muito à pena!!.;https://www.mercadolivre.com.br/bicicleta-de-equilibrio-sem-pedal-4-rodas-mega-compras-cor-menta-verde-conect-brinq-mc938/p/MLB44707055
127;4;Brinquedos e Hobbies;LBU3489218882;Kit 6 Carrinhos Metal Carros 3 O Filme - Relâmpago Mcqueen Kit 6 Carrinhos;55,95;4,9;513;{'Cor': 'Kit 6 carrinhos'};Brasil;5;31/10/2025;"Excelente qualidade! os carrinhos são no padrão hot wheels e matchbox, carroceria de metal e base plástica. A pintura dos detalhes é muito fiel e bem feita.
Pra quem coleciona, pode comprar tranquilo e pra molecada é diversão pura.
Eles servem na maioria das pistas hot wheels e as rodas correm bastante.";https://www.mercadolivre.com.br/kit-6-carrinhos-metal-carros-3-o-filme--relampago-mcqueen/up/MLBU3489218882
128;5;Brinquedos e Hobbies;MLB59338045;Combo De Booster Mega Evolução Pokémon Tcg Mini Booster Box Mega Evolução Português Megaevolução;164,94;4,7;1138;{};Brasil;5;29/10/2025;Preju mas pareceu original… dessa vez! fiquem sempre atentos e a qualquer sinal de adulteração, reportem!.;https://www.mercadolivre.com.br/combo-de-booster-mega-evoluco-pokemon-tcg-mini-booster-box-mega-evoluco-portugus/p/MLB59338045
129;6;Brinquedos e Hobbies;MLB64301051;Cozinha Bancada Infantil Mini Chef Com 46 Peças Maxi Toys Rosa-claro;68,90;4,7;1376;{'Cor': 'Rosa-claro'};Brasil;5;29/01/2026;Minha netinha amou o brinquedo.;https://www.mercadolivre.com.br/cozinha-bancada-infantil-mini-chef-com-46-pecas-maxi-toys/p/MLB64301051
130;7;Brinquedos e Hobbies;MLB17489277;Lego Classic 10713 - Maleta Da Criatividade - Quantidade De Peças 213;104,40;4,9;5593;{};Brasil;5;01/11/2023;Perfeito veio certíssimo. E lego simplesmente é lego.;https://www.mercadolivre.com.br/lego-classic-10713-maleta-da-criatividade-quantidade-de-pecas-213/p/MLB17489277
131;8;Brinquedos e Hobbies;MLB24059448;Papel Sulfite A4 Colorido Chamequinho 75g Rosa;17,35;4,9;6141;{'Cor': 'Rosa', 'Quantidade de folhas': '100', 'Gramagem': '75 g', 'Formato de venda': 'Unidade', 'Unidades por kit': '1'};Brasil;5;10/10/2023;Sem texto;https://www.mercadolivre.com.br/papel-sulfite-a4-colorido-chamequinho-75g-rosa/p/MLB24059448
132;9;Brinquedos e Hobbies;LBU3037571201;Arma Bolinha Gel Arminha Metralhadora Automática Sortido;72,67;4,7;8264;{'Cor': 'Sortido'};Brasil;5;30/04/2025;Muito bonita, ainda não testamos… coloquei pra carregar e as bolinhas pra crescer rsrs.;https://www.mercadolivre.com.br/arma-bolinha-gel-arminha-metralhadora-automatica/up/MLBU3037571201
133;10;Brinquedos e Hobbies;LBU3089004884;100 Cartas Pokémon 10 Brilhantes E 1 Ultra Rara Originais 100 Cartas Pokémon 10 Brilhantes E 1 Ultra Rara Originais Português;79,00;4,9;663;{};Brasil;5;15/09/2025;Sem texto;https://www.mercadolivre.com.br/100-cartas-pokemon-10-brilhantes-e-1-ultra-rara-originais/up/MLBU3089004884
134;11;Brinquedos e Hobbies;LBU3396792386;Kit 9 Carros E Personagens Patrulha Canina Coleção Fricção Colorido;65,56;4,8;1257;{'Cor': 'Colorido'};Brasil;5;12/10/2025;São simples, mas meu filho amou. Veio tudo certinho! o cachorrinho sai, e foi ótimo pois meu filho gosta de ficar tirando pra brincar rs.;https://www.mercadolivre.com.br/kit-9-carros-e-personagens-patrulha-canina-colecao-friccao/up/MLBU3396792386
135;12;Brinquedos e Hobbies;MLB45883026;Brinquedo Bloco De Montar Personagens Desenho Animado Quantidade De Peças 161 Versão Do Personagem Stitch;22,90;4,7;1180;{'Quantidade de peças': '161', 'Versão do personagem': 'Stitch'};Brasil;5;19/07/2025;Vieram todas as peças comprei para meus filhos de 10 anos e já montaram em 1 dias kkkk.;https://www.mercadolivre.com.br/brinquedo-bloco-de-montar-personagens-desenho-animado-quantidade-de-pecas-161-verso-do-personagem-stitch/p/MLB45883026
136;13;Brinquedos e Hobbies;LBU3716802208;Arminha Rambo Gira Tambor Revolver De Espoleta 72 Shot Arma Preto;38,99;4,3;158;{'Cor': 'Preto'};Brasil;5;30/01/2026;Sem texto;https://www.mercadolivre.com.br/arminha-rambo-gira-tambor-revolver-de-espoleta-72-shot-arma/up/MLBU3716802208
137;14;Brinquedos e Hobbies;MLB54093455;Spray De Pum Brincadeira Fedorento Casa Crazze Trolagem 30ml Branco;19,00;4,7;3131;{'Cor': 'Branco'};Brasil;5;24/09/2025;Eu acho que tem fezes de verdade pois o líquido é escuro e espesso, com pedaços de alguma coisa dentro. O cheiro é péssimo, parece de banheiro químico. Já comprei outros que eram artificiais com cheiro de enxofre, que evaporaram rápido. Esse não sai a carniça, onde encosta fica podre! se forem fezes mesmo, deveriam avisar pois tem risco de contato com a pele.;https://www.mercadolivre.com.br/spray-de-pum-brincadeira-fedorento-casa-crazze-trolagem-30ml/p/MLB54093455
138;15;Brinquedos e Hobbies;MLB5304353234;Coelho De Pelúcia Páscoa Pula Emite Som Brinquedo Infantil;32,80;4,8;877;{'Cor': 'Branco'};Brasil;5;07/04/2025;São simplesmente lindos! agora para a páscoa vai ser ótimo.;https://produto.mercadolivre.com.br/MLB-5304353234-coelho-de-pelucia-pascoa-pula-emite-som-brinquedo-infantil-_JM
139;16;Brinquedos e Hobbies;MLB65038356;Treinador Avançado Pokémon Me02.5 Heróis Excelsos Português;359,00;4,8;389;{'Nombre de la carta intercambiable': 'ME02.5', 'Quantidade de cartões de jogo': '121'};Brasil;5;20/02/2026;Vi que esse produto estava, além de barato, mal avaliado por alguns, alegando que era golpe, (abaixaram o preço do produto, talvez por conta disso, pois não conseguiam mais vender)resolvi dar um voto de confiança (não gosto de gastar dinheiro atoa, mas vi que também tinha gente elogiando) e fui premiado, alem de chegar bem embalado, melhor do que muito que eu recebi aqui, ainda me deram presentes. Parabéns, continuem trabalhando honestamente, voltarei sem dúvidas a comprar na loja, não é golpe gente !!! aparentemente, enfim obrigado !.;https://www.mercadolivre.com.br/treinador-avancado-pokemon-me025-herois-excelsos/p/MLB65038356
140;17;Brinquedos e Hobbies;MLB62306855;Triciclo Infantil Kids Avespa Carrinho De Passeio Com Empurrador Colorido;247,08;4,9;175;{'Cor': 'Colorido'};Brasil;5;04/03/2026;Amei, super reforçado, lindo, a criança está encantada com o brinquedo, recomendo!.;https://www.mercadolivre.com.br/triciclo-infantil-kids-avespa-carrinho-de-passeio-com-empurrador-colorido/p/MLB62306855
141;18;Brinquedos e Hobbies;MLB24167722;Bicicleta Bmx 20 Pro-x Série 1 Aço Carbono Freio V-brake Azul Azul/preto;499,99;4,7;7865;"{'Cor': 'Azul/Preto', 'Tamanho do quadro': '20 ""', 'Gênero': 'Sem gênero'}";Brasil;5;13/11/2023;"Meu pequeno gostou de mais !.
É mais bonita ainda pessoalmente!.
Obs : não vem com os suporte de pés !.";https://www.mercadolivre.com.br/bicicleta-bmx-20-pro-x-serie-1-aco-carbono-freio-v-brake-azul/p/MLB24167722
142;1;Calçados, Roupas e Bolsas;MLB65638168;Tênis Carina Street Bdp Puma Branco Liso 37 Br;256,49;4,8;112;{'Cor': 'Branco', 'Tamanho': 'Escolha'};Brasil;5;08/03/2026;Lindo, confortável , estiloso. Ótimo custo benefício. Muito satisfeita.;https://www.mercadolivre.com.br/tnis-carina-street-bdp-puma/p/MLB65638168
143;2;Calçados, Roupas e Bolsas;MLB44924987;Chinelo Casual Masculino E Feminino Top Havaianas Liso 39/40 Branco 33.34 Br;24,97;4,8;66500;{'Cor': 'Branco', 'Tamanho': 'Escolha'};Brasil;5;14/09/2023;Amamos produto original e de boa qualidade.;https://www.mercadolivre.com.br/chinelo-casual-masculino-e-feminino-top-havaianas-liso-3940/p/MLB44924987
