Posição Global;Posição Categoria;Subcategoria;ASIN;Nome;Preço à vista;Nota Geral;Qtd. Avaliações;Nota Comentário;Data Comentário;Comentário;Link
130;20;CALÇADOS, ROUPAS E BOLSAS;MLB45730037;Tênis Masculino Caven 2.0 Puma Puma Black-puma White-puma Silver Geométrico 41 Br;449,9;4,9;421;5;28/07/2025;É lindo peguei tamanho 44 até serviu mas ficou bem justo no pe pois a forma é pequena.;https://www.mercadolivre.com.br/tnis-masculino-caven-20-puma/p/MLB45730037
131;1;ACESSÓRIOS PARA VEÍCULOS;MLB25420247;Capacete Robocop Escamoteável Fechado Mixs Gladiator Delta S Cor Branco Laranja Fosco Tamanho Do Capacete 58;228,71;4,6;13772;5;09/02/2024;"Capacete muito bom confortável.
Atendeu as minhas expectativas.";https://www.mercadolivre.com.br/capacete-robocop-escamoteavel-fechado-mixs-gladiator-delta-s-cor-branco-laranja-fosco-tamanho-do-capacete-58/p/MLB25420247
132;2;ACESSÓRIOS PARA VEÍCULOS;MLB18464291;Capacete Moto Aberto Pro Tork New Liberty Three Azul Tamanho 60 Desenho Solid Viseira Cristal Sólido Brilhante;137,9;4,7;51200;5;06/04/2018;O capacete é bonito, razoavelmente bem acabado e feito com bons materiais. A viseira tem 2 mm de espessura, mas é cristalina e não distorce (nem o meu nem o da minha esposa apresentaram deformação). O casco interno do capacete é maior do que o padrão e se você comprar o número correto vai ficar folgado. Outros usuários avisaram sobre isso e comprei os dois capacetes um número menor que o padrão e vestiram muito bem. O ponto negativo é a falta de um material mais largo e confortável na cinta jugular. É um ótimo segundo capacete, ideal para passeios dentro da cidade. Não recomendo andar com ele em vias expressas ou estradas. A avaliação leva em conta que o capacete custa menos do que um capacete de bicicleta! não espere grande proteção ou materiais luxuosos, mas realmente é um excelente custo benefício, por isso dou 5 estrelas!.;https://www.mercadolivre.com.br/capacete-moto-aberto-pro-tork-new-liberty-three-azul-tamanho-60-desenho-solid-viseira-cristal/p/MLB18464291
133;3;ACESSÓRIOS PARA VEÍCULOS;MLB52950136;Chaveiro Furía Da Noite - Modelo Chaveiro Cor Preto;27,98;4,7;6444;4;09/01/2025;A cor é bonita, vieram dois a mais, mas em compensação, dois descascando e dois não fecham completamente. Aparentemente de boa qualidade.;https://www.mercadolivre.com.br/chaveiro-furia-da-noite-modelo-chaveiro-cor-preto/p/MLB52950136
134;4;ACESSÓRIOS PARA VEÍCULOS;MLB11976985;Capacete Para Moto Pro Tork Sport Moto 788 Cor Rosa Tamanho Do Capacete 58;105,28;4,6;13256;5;20/05/2023;"Já é o 4º capacete que comprei da pro tork, os anteriores foram para os netos que pegavam emprestado e não devolviam 🤙#vóperdeu rsrsrs.
Tenho outro q comprei com detalhes rosa só pra eles não pedirem #vónaoéboba kkkkkk.";https://www.mercadolivre.com.br/capacete-para-moto-pro-tork-sport-moto-788-cor-rosa-tamanho-do-capacete-58/p/MLB11976985
135;5;ACESSÓRIOS PARA VEÍCULOS;MLB48235371;Lona Leve 2x3 Impermeável 300 Micras 3x2 - Ilhós 0,50cm;79,9;4,7;3123;5;13/02/2023;Excelente produto, 100% impermeável, ponto negativo apenas para os ilhóes, com alguns dias nas chuva começa a enferrujar. Como eu comprei 4 lonas, nas outras eu passei uma camada de vernis e resolveu o problema.;https://www.mercadolivre.com.br/lona-leve-2x3-impermeavel-300-micras-3x2-ilhos-050cm/p/MLB48235371
136;6;ACESSÓRIOS PARA VEÍCULOS;MLB61085989;Capacete Race Tech Hit Android Rosa Tamanho Do Capacete 56;328,52;4,9;2198;5;11/09/2025;"Bonito, confortável e possui ótimo custo benefício.
Medi minha cabeça seguindo a tabela de medidas e deu o tamanho certinho no capacete. Fica levemente apertado nos primeiros usos e devo ter ficado umas duas semanas 'laceando', mas como eu faço trajetos curtos de 30min no máximo por dia, acho que é normal o tempo que levou. A viseira é meio dura pra abaixar e levantar no início, mas fica mais leve depois de um tempo de uso. Falando na viseira, gostei mt. Sem fazer nenhum tratamento permite boa visibilidade até em uma noite chuvosa, e eu tomei umas tantas chuvas com ele já e não molhou nadinha a cabeça (sempre mantenho fechada a entrada de ar do topo da cabeça quando pego chuva).
Pra galera que assim como eu, usa óculos, até da pra usar com armações maiores, só que fica um pouco desconfortável, já em óculos mais finos é bem tranquilo, zero incômodos. Aliás, a entrada de ar da frente ajuda pra caramba a não embaçar o óculos e a viseira, mas como a narigueira é baixa, não impede 100%, então as vezes fica levemente embaçado.
Um ponto negativo é que a bavete veio com um defeito na costura.";https://www.mercadolivre.com.br/capacete-race-tech-hit-android-rosa-tamanho-do-capacete-56/p/MLB61085989
137;7;ACESSÓRIOS PARA VEÍCULOS;MLB35906898;Alltak Película Adesiva Vinil Transparente Protetora Ppf Automotivo 2mx 138cm;147,9;4,6;1996;4;31/05/2023;Sem texto;https://www.mercadolivre.com.br/alltak-pelicula-adesiva-vinil-transparente-protetora-ppf-automotivo-2mx-138cm/p/MLB35906898
138;8;ACESSÓRIOS PARA VEÍCULOS;MLB47647559;Tinta Esmalte Direto Na Ferrugem Maza 3,6l Cores Metalizadas Cor Aco Corten;216,11;4,8;2008;5;25/08/2025;Minha primeira compra desta marca. Tem um reconhecimento de ser muito boa.;https://www.mercadolivre.com.br/tinta-esmalte-direto-na-ferrugem-maza-36l-cores-metalizadas-cor-aco-corten/p/MLB47647559
139;9;ACESSÓRIOS PARA VEÍCULOS;MLB24983724;Faixa D20 Deluxe 1993 1994 Azul + Adesivo Chevrolet Grafite;134,31;4,6;3378;5;01/01/2024;Muito bom.;https://www.mercadolivre.com.br/faixa-d20-deluxe-1993-1994-azul-adesivo-chevrolet-grafite/p/MLB24983724
