Posição Global;Posição Categoria;Subcategoria;ASIN;Nome;Preço;Nota Geral;Qtd. Avaliações;País;Data Comentário;Nota Comentário;Comentário;Link
1;1;Alimentos e Bebidas;B097BYXGXN;Ketchup Heinz Tradicional 1,033KG;17,90;4,9;20.935;Brasil;09/01/2026;5,0;De primeira qualidade e muita economia;https://www.amazon.com.br/dp/B097BYXGXN
2;2;Alimentos e Bebidas;B07Y2GTX9G;Doce de Leite Cremoso FLORMEL 210 Gramas;20,99;4,6;3.940;Brasil;07/01/2026;5,0;Estou em tratamento de c.a e não posso comer doce(açúcar) por isso comprei este da flormel, ele é divino, cremoso e muito gostoso;https://www.amazon.com.br/dp/B07Y2GTX9G
3;3;Alimentos e Bebidas;B07HDSL78H;Orfeu Café Clássico em Grãos, 100% Arabica, Torra Média, 1kg;137,89;4,7;18.482;Brasil;05/01/2026;5,0;café top, topíssimo!! Comprei numa promoção e valeu super a pena. Tomava o Mellitta gourmet da caixa verde, mas ele é superior, ou seja, inferior a este que é o especial.;https://www.amazon.com.br/dp/B07HDSL78H
4;4;Alimentos e Bebidas;B089T37GDT;Orfeu Café Bourbon Amarelo Torrado e Moído, 100% Arabica, Torra Média Clara, 250g;26,79;4,7;1.407;Brasil;01/01/2026;5,0;Sabor, doçura e aroma excelentes, para quem aprecia um bom café arábica;https://www.amazon.com.br/dp/B089T37GDT
5;5;Alimentos e Bebidas;B0F2GMT6T3;Integralmedica - Barra de Proteína Whey Protein Crisp Bar Ovomaltine - Snack Proteíco - Pré e Pós-Treino - 12 Unidades;78,13;4,7;9.830;Brasil;11/11/2025;5,0;Ótima barra, gosto e tamanho ideal (pra mim, acho), quantidade proteica boa, só talvez um pouco dura, mas não de um jeito ruim. Comparando com outras marcas, o preço é um pouco maior, mas vale a pena.;https://www.amazon.com.br/dp/B0F2GMT6T3
6;6;Alimentos e Bebidas;B00P9VQCXY;Andorinha - Azeite vidro, Extra virgem, 500ml;34,49;4,9;9.204;Brasil;15/12/2025;5,0;Excelente custo benefício, azeite de oliva Andorinha é de excelente qualidade e uma marca de longa data no mercado.  Preço estava excelente;https://www.amazon.com.br/dp/B00P9VQCXY
7;7;Alimentos e Bebidas;B09M2B14V7;YoPRO Bebida Láctea UHT Chocolate 15g de proteínas 250ml - 12 unidades;89,10;4,7;23.453;Brasil;06/01/2026;5,0;Ótimo pós treino;https://www.amazon.com.br/dp/B09M2B14V7
8;8;Alimentos e Bebidas;B081QWG9J1;Ninho Nestle Zero Lactose 700G;39,99;4,8;4.096;Brasil;02/01/2026;5,0;Muito bom, e um ótimo custo benefício;https://www.amazon.com.br/dp/B081QWG9J1
9;9;Alimentos e Bebidas;B09JZBTWV1;Pack de Coca-Cola sem Açúcar 350Ml 6 unidades;22,14;4,8;1.844;Brasil;03/01/2026;5,0;Produto de ótima qualidade;https://www.amazon.com.br/dp/B09JZBTWV1
10;10;Alimentos e Bebidas;B09WTLQ53R;Ninho Fases 1 - Fórmula Infantil, 1.2 kg (Pacote de 1);69,20;4,8;9.102;Brasil;10/01/2026;5,0;Qualidade, prazo de entrega e sabor.Satisfeitos. Gratidão.;https://www.amazon.com.br/dp/B09WTLQ53R
11;11;Alimentos e Bebidas;B0964WBFFG;Leite em Pó Ninho Integral Sachê 750g;41,99;4,8;3.732;Brasil;10/12/2025;5,0;Produto de boa qualidade ótimo custo;https://www.amazon.com.br/dp/B0964WBFFG
12;12;Alimentos e Bebidas;B0BYTLY4K1;Pack de Monster Absolutely Zero LT 473ml - Unidade 6 unidades;53,94;4,9;446;Brasil;23/12/2025;5,0;Excelente produto;https://www.amazon.com.br/dp/B0BYTLY4K1
13;13;Alimentos e Bebidas;B0DTLN7RPP;Cerveja Corona Extra Lata 473ml - Pack com 12 unidades;61,49;4,2;76;Brasil;09/01/2026;5,0;Qualidade boa!Entrega rápida.Ótimo custo benefício.;https://www.amazon.com.br/dp/B0DTLN7RPP
14;14;Alimentos e Bebidas;B0FPRGYFCL;Achocolatado NESCAU® 2,01kg;46,90;4,9;85;Brasil;15/11/2025;5,0;Super recomendo, excelente custo benefício;https://www.amazon.com.br/dp/B0FPRGYFCL
15;15;Alimentos e Bebidas;B0F35GPLGV;Pringles Pack Promo Salgadinho de Batata Frita 3 Sabores - Original, Creme e Cebola e Churrasco;29,99;4,6;4.489;Brasil;10/12/2025;5,0;Já é a segunda vez que compro, em ambas as duas as batatas vieram quebradas,nessa segunda entrega capricharam em amassar as latas kkkkEnfim,não me incomodo de virem quebradas,mas a Amazon devia ter mais cuidado com os pacotes (não é a primeira encomenda que vem detonada,já recebi muitas assim e por sorte não foram produtos frágeis). As batatas são maravilhosas, sempre estarei recomprando pq é bem em conta pegar na promoção;https://www.amazon.com.br/dp/B0F35GPLGV
16;1;Apps e Jogos;B00992CF6W;Nome não encontrado;Preço não disponível;N/A;N/A;Brasil;19/12/2025;5,0;Muito bom;https://www.amazon.com.br/dp/B00992CF6W
17;2;Apps e Jogos;B09ML2GCMD;Nome não encontrado;6,49;N/A;N/A;Brasil;1 de março de 2025;5,0;Parou de funcionar não comprem;https://www.amazon.com.br/dp/B09ML2GCMD
18;3;Apps e Jogos;B0CPB81K88;Nome não encontrado;113,38;N/A;N/A;Brasil;03/12/2025;5,0;Minha filha adorou a brincadeira de colorir;https://www.amazon.com.br/dp/B0CPB81K88
19;4;Apps e Jogos;B0GDJXB38B;Nome não encontrado;Preço não disponível;N/A;N/A;N/A;N/A;N/A;Sem comentários disponíveis;https://www.amazon.com.br/dp/B0GDJXB38B
20;5;Apps e Jogos;B0BHF4NZSJ;Nome não encontrado;43,61;N/A;N/A;Brasil;05/06/2025;4,0;igual ao anúncio;https://www.amazon.com.br/dp/B0BHF4NZSJ
21;6;Apps e Jogos;B0CRB33MNS;Nome não encontrado;113,38;N/A;N/A;N/A;Avaliado na Alemanha em 15 de abril de 2025;N/A;TOP;https://www.amazon.com.br/dp/B0CRB33MNS
22;7;Apps e Jogos;B072J5K6F7;Nome não encontrado;43,61;N/A;N/A;Japão;10/01/2023;N/A;まぁいわゆるマイクラの劣化版;https://www.amazon.com.br/dp/B072J5K6F7
23;8;Apps e Jogos;B0DF5PLDQK;Nome não encontrado;43,61;N/A;N/A;Brasil;23/07/2025;1,0;Cancelar;https://www.amazon.com.br/dp/B0DF5PLDQK
24;9;Apps e Jogos;B00BFBSV72;Nome não encontrado;43,61;N/A;N/A;Brasil;18/06/2023;5,0;GOSTEI.;https://www.amazon.com.br/dp/B00BFBSV72
25;10;Apps e Jogos;B0DRD85GFT;Nome não encontrado;43,61;N/A;N/A;N/A;N/A;N/A;Sem comentários disponíveis;https://www.amazon.com.br/dp/B0DRD85GFT
26;11;Apps e Jogos;B0D4QFXF2D;Nome não encontrado;113,38;N/A;N/A;N/A;N/A;N/A;Sem comentários disponíveis;https://www.amazon.com.br/dp/B0D4QFXF2D
27;12;Apps e Jogos;B0BY31TH4N;Nome não encontrado;Preço não disponível;N/A;N/A;Brasil;01/02/2025;5,0;Muito bom;https://www.amazon.com.br/dp/B0BY31TH4N
28;13;Apps e Jogos;B0FQZSWQGB;Nome não encontrado;Preço não disponível;N/A;N/A;Reino Unido;02/01/2026;N/A;Awful to navigate not much content;https://www.amazon.com.br/dp/B0FQZSWQGB
29;14;Apps e Jogos;B0C8PG4M21;Nome não encontrado;Preço não disponível;N/A;N/A;N/A;Avaliado nos Estados Unidos em 13 de dezembro de 2025;N/A;A mi hija le encanto gracias;https://www.amazon.com.br/dp/B0C8PG4M21
30;15;Apps e Jogos;B0141KIMPE;Nome não encontrado;43,61;N/A;N/A;Brasil;07/08/2025;1,0;-;https://www.amazon.com.br/dp/B0141KIMPE
31;1;Automotivo;B076X7T368;Espuma Mágica Aerossol 400ml / 370g;22,43;4,5;11.730;Brasil;03/01/2026;5,0;O resultado do produto é muito satisfatório!Ainda ficaram uma marcas, mas acredito que com uma segunda aplicação resolva. De 100% tirou algo em torno de 80/85%. Tendo em observação que o o carro se encontrava com uma capa de couro a 6 anos, as marcas que ficaram pode ser encardido, mas deixando claro que o produto vale a pena!;https://www.amazon.com.br/dp/B076X7T368
32;2;Automotivo;B0CLDRS18S;WAP Aspirador de Pó Automotivo CAR 12V2, Portátil, 420ml, com Recipiente Removível e Filtro Lavável, 180W 12VDC;108,99;4,5;3.186;Brasil;28/11/2025;5,0;Aspirador bacana, super prático.Ultilizo direto na aspiração do carro.Boa potência, boa sucção. Estou muito satisfeito com a compra.;https://www.amazon.com.br/dp/B0CLDRS18S
33;3;Automotivo;B0FWNKVTSN;Protetor Solar Para-brisa, Quebra Sol Portátil, Proteção Térmica UV, Protetor Solar com Isolamento Térmico, Retrátil, Protetor Térmico Para Carro, Protetor Dobrável Preto para Carro;39,00;4,0;29;Brasil;29/12/2025;5,0;Ótimo custo benefício, realmente cumpre o anúncio e super recomendo.;https://www.amazon.com.br/dp/B0FWNKVTSN
34;4;Automotivo;B08VBK2Z35;Vonixx SINTRA FAST - Multilimpador flotador universal, bactericida e germicida de pH balanceado, 500ML;34,11;4,8;2.291;Brasil;30/11/2025;5,0;bom produto, rende, cheiro de desinfetante;https://www.amazon.com.br/dp/B08VBK2Z35
35;5;Automotivo;B09N9TYTSJ;Veda Porta Rolinho em Couro Sintético – Isolamento Térmico, Acústico, Protege Contra Insetos e Luz – Branco 80cm - Comfort Door;25,60;4,6;2.084;Brasil;23/12/2025;5,0;Produto de courino, veda muito bem a fresta da porta. Tive que cortar uma parte por ser maior do que a porta.;https://www.amazon.com.br/dp/B09N9TYTSJ
36;6;Automotivo;B07WZQC1NJ;CAPACETE ABERTO PRO TORK NEW LIBERTY 3 SOLID PRETO FOSCO TAM. 60;101,00;4,6;15.049;Brasil;11/01/2026;5,0;Até agora não deu sinal de cair a viseira, muito bom capacete pra o dia a dia;https://www.amazon.com.br/dp/B07WZQC1NJ
37;7;Automotivo;B0CTD5MCW1;Snow Foam Pump 3 Em 1 Manual Espuma Água Químicos SGT-9924;49,90;4,6;399;Brasil;04/01/2026;5,0;Excelente produto, espuma excelente, utilizei com detergente para testar e a espuma ficou cremosa.;https://www.amazon.com.br/dp/B0CTD5MCW1
38;8;Automotivo;B08B1VX8RY;Vonixx INTENSE - Renovador de plásticos com proteção UV, 500ML;30,36;4,8;2.556;Brasil;15/12/2025;5,0;Produto muito bom e deixa um brilho ótimo no painel do carro e não deixa úmido.;https://www.amazon.com.br/dp/B08B1VX8RY
39;9;Automotivo;B08N844668;vonixx Shampoo Automotivo Concentrado 1:400 V-floc 3 Litros;62,20;4,8;1.419;Brasil;09/01/2026;5,0;Produto realmente fantástico, é o melhor shampoo automotivo que já comprei. Rende muito, faz muita espuma, limpa de verdade e tem cheiro de uva! Esse último atributo não precisava mas é verdade. Enfim: recomendo.;https://www.amazon.com.br/dp/B08N844668
40;10;Automotivo;B07RRYYBWG;Limpa Estofados ZIP spray 300ml, MY PLACE, AE2500011;17,75;4,3;244;Brasil;01/01/2026;5,0;Ótimo produto e deixa um cheiro de limpeza.;https://www.amazon.com.br/dp/B07RRYYBWG
41;11;Automotivo;B07YDW6YXS;CAPACETE FECHADO PRO TORK SPORT MOTO 788 PRETO - BRANCO TAM. 56;82,00;4,5;7.873;Brasil;09/01/2026;5,0;Preço bom , entrega no prazo e o produto também é bom, pelo preço não é um top de linha , mas quebra um galho para quem está sem grana, já protege vc;https://www.amazon.com.br/dp/B07YDW6YXS
42;12;Automotivo;B077SKG88X;Bosch Palheta Dianteira Aerofit AF18, Limpador de Para-brisa com Tratamento de Grafite, 18 Polegadas 450 mm, Unitário;31,97;4,6;5.207;Brasil;02/12/2025;5,0;Palhetas excelentes, muito silenciosas e limpam muito bem. Vale a muito a pena. Na Amazon bem mais barato que em lojas físicas.;https://www.amazon.com.br/dp/B077SKG88X
43;13;Automotivo;B07CYRXDZR;CAPACETE FECHADO PRO TORK NEW LIBERTY 4 SOLID PRETO FOSCO TAM. 58;97,00;4,4;4.123;Brasil;13/12/2025;5,0;Capacete bom, material de qualidade, ótimo custo benefício;https://www.amazon.com.br/dp/B07CYRXDZR
44;14;Automotivo;B09SZKKHZ5;Termometro Industrial Culinaria a Laser Para Forno Freezer -50º A 380ºC Digital Sem Contato LCD Termômetro Infravermelho Pirômetro de Testador De Temperatura IR Industrial com Emissividade Ajustável;35,54;4,5;538;Brasil;13/12/2025;5,0;Esse termômetro me surpreendeu. Não botava muita fé. Mas testei com mistura de água e gelo e com água fervendo. Nos dois casos deu leitura com menos de 1 grau de erro. Testei contra um termômetro de cozinha e bateu. É super simples de usar, leitura em segundos. Só cuide para fazer a leitura de perto, tipo 15-20 cm.;https://www.amazon.com.br/dp/B09SZKKHZ5
45;15;Automotivo;B0911TPCWY;vonixx Limpador Bactericida para Interior Sintra Pro 3 Litros;48,57;4,7;323;Brasil;27/12/2025;5,0;Produto Top de linha! Limpa bem de verdade!;https://www.amazon.com.br/dp/B0911TPCWY
46;1;Bebês;B099KXW911;Fralda Turma da Mônica Baby Jumbo M 28 Unidades;23,99;4,7;45.173;Brasil;09/01/2026;5,0;Entrega super rápido,bem embalado, preço excelente.;https://www.amazon.com.br/dp/B099KXW911
47;2;Bebês;B0BFXJHXDP;Huggies Supreme Care Fralda Descartável, Tecnologia Xtra-Flex, Canais em X, Máxima Proteção, XG, 140 Unidades;189,90;4,7;26.430;Brasil;27/11/2025;5,0;Essa é a melhor fralda custo benefício,linha premium pagando pouco, já testei todas as mercas possíveis e essa reformulada foi uma dos meus melhores achados, ela n vaza se está vazando o problema é de colocação, sobre o gel atrás, poderia ser maior para evitar vazamentos mas isso se resolve no ajuste, está fralda raramente, muito difícil vaza a noite  aguenta as 12h certamente, não caio mais em avaliações ruins pois com crtz que com esse valor e qualidade vcs não acham,  eu uso tanto pro dia quanto para noite,nunca assou meu neném;https://www.amazon.com.br/dp/B0BFXJHXDP
48;3;Bebês;B07MLKGDDH;Bepantol Baby Pomada Assadura Bebe Hipoalergênica 120g;48,90;4,9;45.271;Brasil;15/12/2025;5,0;Produto perfeito, uso desde que minha filha nasceu, nunca teve alergia, deixa a pele super hidratada e ela nunca teve assaduras;https://www.amazon.com.br/dp/B07MLKGDDH
49;4;Bebês;B09BBDVPB1;MamyPoko Lenços Umedecidos Dia&Noite 200 Unidades;27,03;4,8;46.699;Brasil;19/12/2025;5,0;Lenço maravilhoso, muito parecido com a umidade e maleabilidade e suavidade que o da Bepantol tem, a única coisa que o diferencia é o cheiro que o da mamy poko tem cheiro e pra quem não gosta pode ser ruim. Aqui em casa não incomoda ou deu alergia, então aprovado;https://www.amazon.com.br/dp/B09BBDVPB1
50;5;Bebês;B07MJ251Z8;Huggies Lenços Umedecidos Rosto e Corpo Limpeza 4 x 48-192 lenços;27,99;4,7;7.527;Brasil;02/12/2025;5,0;Melhor preço que encontrei na Amazon sem falar com os produtos News são maravilhosos esse lencinho super limpa muito bem e um cheiro incrível.;https://www.amazon.com.br/dp/B07MJ251Z8
51;6;Bebês;B078HS3SKS;Baby Dove Sabonete Líquido Da Cabeça Aos Pés Hidratação Enriquecida 400Ml;28,99;4,8;12.574;Brasil;08/12/2025;5,0;O sabonete líquido Baby Dove é maravilhoso! Tem uma textura cremosa, espuma suave e um cheiro bem delicado, ideal para pele sensível. Deixa a pele macia, hidratada e sem aquela sensação de ressecamento. A fórmula é realmente gentil, não causa irritação e é ótima até para uso diário. A embalagem é prática e rende bastante. Um produto confiável e de excelente qualidade, recomendo muito! 💙🧼✨;https://www.amazon.com.br/dp/B078HS3SKS
52;7;Bebês;B07FN7T2LK;Huggies Lenços Umedecidos Recém-Nascido Sem Fragrância 6 x 48 Un;49,99;4,8;11.152;Brasil;06/01/2026;5,0;Esse lenço é perfeito pra RN, com ótimo custo benefício. Grossinho, sem cheiro, pouco úmido.;https://www.amazon.com.br/dp/B07FN7T2LK
53;8;Bebês;B08K4L452V;Fralda Pampers Premium Care Pants Tamanho XXG, Fácil de Vestir, 90 Unidades;150,72;4,8;6.527;Brasil;16/07/2025;5,0;Sou pai, e como muitos, também passei por aquela fase de testar várias marcas até encontrar uma fralda que realmente me deixasse tranquilo. Desde o tamanho P usamos a Pampers Premium Care, e a versão Pants no tamanho XXG tem sido a melhor escolha aqui em casa.Desde o primeiro uso, percebi que ela se destaca pelo conforto. É super macia ao toque, parece feita com carinho, pensando mesmo no bem-estar do bebê. Além disso, tem um cheirinho suave e agradável, que reforça a sensação de limpeza e cuidado.A proteção contra vazamentos é excelente. Mesmo em noites longas ou durante passeios mais demorados, ela segura muito bem. As barreiras são eficientes e evitam aqueles acidentes indesejados que a gente conhece bem. E posso dizer com certeza: desde que começamos a usar, não tivemos mais problemas com vazamentos.Outro ponto importantíssimo pra mim: meu filho nunca teve assaduras com essa fralda. A pele dele fica sequinha e saudável, o que me dá a certeza de que estou usando um produto realmente de qualidade.No fim das contas, é uma fralda que funcionou muito bem aqui em casa. Resolve o que precisa resolver, é prática e confiável. E enquanto continuar assim, vamos seguir com ela.;https://www.amazon.com.br/dp/B08K4L452V
54;9;Bebês;B07FN7VP5Y;Fralda Descartável Huggies Máxima Proteção Tamanho P 48 unidades – Nova fralda Supreme Care com absorção especial para cocô líquido e indicador de troca. (embalagem pode variar);42,50;4,8;60.512;Brasil;24/10/2025;5,0;Essa nova versão da antiga supreme care é ótima, conseguiram deixar ela mais macia e mais fina sem diminuir a qualidade da fralda, o design de elástico nas costa e nas laterais são ótimos, a fralda segura o xixi por horas a noite não tive problema com vazamentos por aqui, pelo valor compensou muito, veio certo e chegou em 3 dias após a compra, gostei muito.;https://www.amazon.com.br/dp/B07FN7VP5Y
55;10;Bebês;B08LK15F8N;Granado Sabonete Líquido Bebê, Tradicional, 500ml;34,06;4,8;30.672;Brasil;28/12/2025;5,0;Excelente sabonete! Muito cheiroso e ajuda a hidratar a pele.;https://www.amazon.com.br/dp/B08LK15F8N
56;11;Bebês;B093G7B8CN;Fralda Pom Pom Protek Proteção de Mãe Jumbo P 30 Unidades;22,53;4,6;24.062;Brasil;10/01/2026;5,0;Gosto muito da fralda pompom, é confortável para o bebê, tem um cheirinho gostoso e de boa qualidade. Das fraldas mais simples que já usei essa é a melhor, meu bebê se adaptou muito bem e não é uma fralda cara. Sempre volto aqui para comprar. Aguenta bem o xixi e se não for uma bomba de coco ela segura bem também.;https://www.amazon.com.br/dp/B093G7B8CN
57;12;Bebês;B00TQCAAQW;Mustela Creme Preventivo De Assaduras Vitaminado 1>2>3 108g - Pomada Antiassaduras Para Bebês Com Tripla Ação - 98% De Ingredientes De Origem Natural;74,00;4,8;12.154;Brasil;05/12/2025;5,0;Pomada preventiva maravilhosa, usei nos meus filhos mais velhos e vou usar novamente no que vai nascer. Leve ao toque, não é grudenta, rende muito e o melhor, tem uma boa composição sem ativos agressivos ao bebê.;https://www.amazon.com.br/dp/B00TQCAAQW
58;13;Bebês;B095R9CKYR;Huggies Fralda Descartável Premium Natural Care RN - 34 Fraldas;33,99;4,9;16.246;Brasil;06/01/2026;5,0;Comprei a Huggies Premium Natural Care tamanho RN (34 fraldas) e foi uma excelente escolha. O preço estava ótimo e usamos diariamente.Meu filho nasceu bem pequeno (2,1 kg) e essa RN serviu super bem: é confortável, macia e encaixa perfeitamente no corpinho, sem ficar folgada. A fralda veste bem e dá segurança no uso do dia a dia.No geral, excelente custo-benefício e qualidade. Recomendo, principalmente para quem tem recém-nascido menorzinho.;https://www.amazon.com.br/dp/B095R9CKYR
59;14;Bebês;B08HTGRMD3;Fralda Pampers Splashers Para Nadar Baby Shark Tamanho XG 10 Unidades;32,89;4,8;1.659;Brasil;31/12/2025;5,0;Simplesmente maravilhosa, comprei com medo de não dar certo, meu bebê pesa 11kg e ficou perfeito, não entrou um pingo de água, nem parecia que meu bebê tinha feito xixi, muito fininha perfeita mas assim que faz cocô tem que trocar porque vaza, comprarei novamente;https://www.amazon.com.br/dp/B08HTGRMD3
60;15;Bebês;B082L13YPQ;Lenços Umedecidos Pampers Aroma de Aloe Vera 192 Unidades;35,14;4,8;15.927;Brasil;11/12/2025;5,0;Cheiroso, molhadinho.;https://www.amazon.com.br/dp/B082L13YPQ
61;1;Beleza;B07LFGWRC7;Clear Shampoo Men Anticaspa Ice Cool Menthol 400Ml;18,19;4,8;17.214;Brasil;06/12/2025;5,0;Quem já conhece sabe o quanto é bom..ótimo produto e ótimo custo benefício;https://www.amazon.com.br/dp/B07LFGWRC7
62;2;Beleza;B00XDX9JJY;NIVEA Sabonete Líquido Óleo de Banho 200ml, Limpeza Corporal, Pele Macia, 55% Óleos Naturais, Sensação Hidratante;29,89;4,7;33.172;Brasil;27/12/2025;5,0;Entrega atrasou bastante, mas chegou bem embalado e não vazou. Aroma suave e agradável. excelente produto p tirar protetor solar e desodorante a noite no ultimo banho, melhor ainda na promoção (paguei 25,00 na black);https://www.amazon.com.br/dp/B00XDX9JJY
63;3;Beleza;B07H113TPQ;ELSÉVE Óleo Capilar L'Oréal Paris Elseve Óleo Extraordinário 100Ml - Leave In Anti Frizz Protetor Térmico Tratamento Reconstrutor Para Todos Os Tipos De Cabelo;36,90;4,8;106.573;Brasil;03/01/2026;5,0;Excelente produto, ajuda na hidratação, pode ser usado com o cabelo seco ou molhado, tem o cheiro agradavél e dura muito, tendo um ótimo custo beneficío. Se adapta ao uso combinado de cremes que nao sejam da marca elseve e da certo para cabelos crespos e cacheados. O óleo é somente um pouco denso e pesado, ainda mais com o passar do tempo. Se usado no cabelo sujo e em quantidade um pouco maior ele deixa obviamente o cabelo com aspecto de oleoso, mas com o tempo você aprende a quantidade que o seu cabelo e a situação pedem.;https://www.amazon.com.br/dp/B07H113TPQ
64;4;Beleza;B07DKFLT3S;Loréal Elsève Creme Tratamento Leave in Cicatri Renov, Branco;18,14;4,8;43.035;Brasil;09/01/2026;5,0;maravilhosoooo, entrega oq promete, tem um cheiro perfeito ( o mesmo cheiro do shampoo dessa linha) rende bastante, tem uma textura mais densa, então o recomendo é em cabelos mais finos não usar todo dia pra não pesar. uso antes de secar o cabelo com secador, ou quando faço chapinha e é perfeito!!;https://www.amazon.com.br/dp/B07DKFLT3S
65;5;Beleza;B0CTR4FL63;Protetor Solar Facial Principia FPS 60, 16,5% Mix de Filtros UV + 5% Niacinamida FPS 60 PS-01 com 40ml;39,59;4,6;11.236;Brasil;02/01/2026;5,0;amo esse protetor, o melhor que ja usei até agora. Ajuda nas espinhas, não arde o olho e não fica branco. Mas pode ficar um pouco oleoso caso use muito. Dura uns dois meses se usar todos os dias;https://www.amazon.com.br/dp/B0CTR4FL63
66;6;Beleza;B0D6764Y9T;MÁSCARA SEBASTIAN PROFESSIONAL NO BREAKER 500ML;212,80;4,3;34;Brasil;29/12/2025;5,0;Perfeita, cabelos renovados;https://www.amazon.com.br/dp/B0D6764Y9T
67;7;Beleza;B07SBXMSGB;Argan Óleo Reparador 50ml , Lola Cosmetics;15,27;4,8;36.611;Brasil;22 de março de 2023;5,0;A maioria dos óleos de argan são na verdade um blend de silicones que contém em sua composição o óleo de argan e, quando muito, mais algum outro ativo de tratamento. Já no da Lola, o óleo de argan é o 2º ativo da composição. O primeiro é o Cocoato de isoamila, um emoliente derivado da beterraba e do óleo de coco. Contém ainda glicerina, extratos de algas marinhas, proteínas hidrolisadas do arroz e da soja e glicina. Logo, é uma composição mais rica em óleo de argan e muito mais completa que a maioria dos óleos vendidos em supermercados, farmácias e até mesmo por aqui na Amazon.Sim, estes últimos podem até ser mais embelezadores, dada a alta quantidade de silicones que irão conferir, imediatamente, brilho e maciez, mas o óleo da Lola é um óleo que, além de embelezar, irá efetivamente tratar, uma vez que sua composição possui BEM MAIS óleo de argan e BEM MAIS ativos hidratantes e restauradores. E OK, talvez haja muita gente que talvez até prefira os óleos com blend de silicones, especialmente porque procuram embelezar o cabelo de forma mais perceptível e imediata (algo que os silicones realmente entregam). No entanto, é um erro achar que eles irão tratar mais que o da Lola. É justamente o contrário. Para mim são produtos com finalidades diferentes.Dito isto, é o meu óleo predileto para finalizar o cabelo, seja seco ou molhado, porque além de hidratar e diminuir o frizz, rende bastante, tem um cheiro muito agradável e não acumula nos fios. Recomendo demais.;https://www.amazon.com.br/dp/B07SBXMSGB
68;8;Beleza;B07NQ1GN5P;Risqué Esmalte Cremoso Sol Laranja Anima 8Ml;2,49;4,8;42.614;Brasil;14/12/2025;5,0;Super recomendo. Após a finalização do esmalte seco, usar o Top Coat Fixador, ajuda na fixação do esmalte por mais tempo, dando mais brilho. Lavo pratos, e o esmalte continua intacto. Claro, que com a rotina, a camada vai saindo, mas, dura um bom tempo, no meu caso, uns 5 dias.;https://www.amazon.com.br/dp/B07NQ1GN5P
69;9;Beleza;B072MK7BN2;La Roche-Posay Cicaplast Baume B5+ Cuidado Multirreparador Calmante;76,90;4,8;16.396;Brasil;06/01/2026;5,0;Ótimo creme, a pele fica uma seda,  já comprei novamente,  super indico, para cicatrizes é ótima;https://www.amazon.com.br/dp/B072MK7BN2
70;10;Beleza;B0CDNN9KKL;NIVEA Sérum Facial Cellular Luminous 630® ANTIMARCAS Acne 30ml;29,90;4,5;368;Brasil;28/09/2025;5,0;"Bom produto! Já havia testado os outros 2 tipos de Sérum avançado da linha Luminous da Nivea, e mais uma vez, bons resultados no clareamento de manchas. Como queria agora específico para manchas de acne, vem dando muito certo!!As ressalvas que faço: A textura é diferente, em gel e é realmente alcoólico - não me incomodou, mas pode ser um problema pra peles mais sensíveis; Diferente dos outros séruns Nivea, esse pode não ter boa absorção quando utilizado junto a outros produtos, mesmo aguardando secar bem, pode esfarelar.";https://www.amazon.com.br/dp/B0CDNN9KKL
