Posição Global;Posição Categoria;Subcategoria;ASIN;Nome;Preço;Nota Geral;Qtd. Avaliações;País;Data Comentário;Nota Comentário;Comentário;Link
71;11;Beleza;B07RK4HST7;CeraVe, Loção Hidratante Corporal, com textura Fluida e Ácido Hialurônico;87,90;4,8;77.648;Brasil;17/01/2023;5,0;Assim como qualquer cosmético, a pessoa que compra pode não apresentar bons resultados, mas, no meu caso, está mais que aprovado. Falando por mim, notei que minha pele está com uma maciez jamais tida anteriormente, além de estar com um viço maravilhoso.Estou no ápice da minha adolescência, 16 anos, então tenho acnes de vez em quando e possuo hiperpigmentações na área das minhas bochechas. Minha pele, em muitos momentos,  ficava ressecada, descascando, e eu não usava hidratante de forma cotidiana, porque, embora tivesse muitos, nenhum funcionava bem para mim, só traziam ainda mais oleosidade para a minha pele e, consequentemente, acnes e cravos.Pesquisei muito sobre o CeraVe e decidi adquirir. Felizmente, a minha pele o recebeu muito bem, se adaptou logo de início. Uso no skincare diurno e noturno. Mas, há uns dias atrás, decidi, no período da manhã, voltar a aplicar um hidratante de vitamina c na pele e, no período da noite, o CeraVe, mas minha pele não reagiu bem, então voltei para o meu favoritinho. Prossigo usando diariamente, dia e noite.Quanto ao gel de limpeza, é também muito gentil. Faz espuma suficiente e é econômico, pois não precisa de muito produto para conseguir realizar uma limpeza de qualidade. Eles não têm perfume, não irrita o nariz e não irrita os olhos (apenas se colocar muito nos olhos, óbvio). Lavo a pele por dois minutos e isso tem me ajudado muito.É interessante saber que só usar cosmético não melhora a pele e dependendo do grau de acne (se for o caso), não vai acontecer milagre. Além da loção, que é super levinha, não deixa a pele grudenta nem nada assim, eu uso o gel de limpeza da CeraVe (ambos os produtos com as três ceramidas essenciais e o ácido hialurônico), também uso um sérum de uma combinação de boas porcentagens de ácidos e o meu protetor solar. Ademais, me alimento bem (não parei de comer as minhas besteiras, só equilibro tudo) e bebo muitíssima água.Cuide-se bem! E dê uma chance para o CeraVe (loção - ou creme - e o gel)! Se não funcionar para o seu rosto, teste na pele do corpo, não se arrependerá. Uso nos joelhos, cotovelos, pés e axilas, deixou tudo SUPER macio e hidratado - como jamais foram - em três dias.Veio tudo embalado perfeitamente. Dentro de uma caixa, com fita nas tampas dos produtos para não vazar o conteúdo. Chegou dois dias antes do prazo.;https://www.amazon.com.br/dp/B07RK4HST7
72;12;Beleza;B074LTNQBP;Morte Súbita Máscara Super Hidratante 450g , Lola Cosmetics;38,30;4,8;74.659;Brasil;03/01/2026;5,0;Produto muito bom, o cheiro nem se fala ótimo! Hidrata profundamente e é bem denso e rende super ele vem muito produto ótimo custo benefício eu amei excelente!;https://www.amazon.com.br/dp/B074LTNQBP
73;13;Beleza;B08VGBZGWV;NIVEA Sabonete em Barra Creme Care Promo 6 un. 90g - Limpa e deixa a pele macia mesmo após o banho, com glicerina, fragrância NIVEA Creme e o exclusivo ingrediente Eucerit;17,90;4,8;12.178;Brasil;07/01/2026;5,0;A Nivea tem um dos melhores sabonetes em barra. Muitoooo cremoso, incrível. Perfume suave, maravilhoso. Sou fã. E a Amazon arrasou no preço. Vou aproveitar e comprar mais.;https://www.amazon.com.br/dp/B08VGBZGWV
74;14;Beleza;B079VXP6B6;NIVEA SUN Protetor Solar Protect & Hidrata FPS 50 200ml, Alta Proteção UVA/UVB, Hidratação Prolongada, Rápida Absorção, Pantenol, Cuidado Solar Corporal e Facial;32,37;4,8;7.441;Brasil;15/12/2025;5,0;Tem um cheiro agradável, não é oleoso e não é aquele tipo de protetor que se você não espalhar bem ele te deixa branco igual um manequim, em poucas massagens com as mãos a pele já absorve.;https://www.amazon.com.br/dp/B079VXP6B6
75;15;Beleza;B09GHN14FP;Danos Vorazes Óleo Reparador 50ml , Lola Cosmetics;18,51;4,8;12.525;Brasil;23/12/2025;5,0;Muito bom esse óleo, o cabelo fica com outra textura, só não pode passar muito que pesa. O cheiro é muito bom, ameeei;https://www.amazon.com.br/dp/B09GHN14FP
